### ISSUE TITLE
discovery is very slow if a device is down

### ISSUE THREAD

**Issue by candlerb** [librenms/librenms#4455]
DO NOT DELETE THIS INFORMATION.

> Please read this information carefully.

- [X] Is your install up to date? [Updating your install](http://docs.librenms.org/General/Updating/)
      Please do not submit an issue if your install is not up to date within the last 24 hours or on a stable monthly release.
- [X] Please include all of the information between the `====================================` section of `./validate.php`.
- [ ] If you would like us to add a new device then please provide the information asked for [here](http://docs.librenms.org/Support/FAQ/#faq20)
- [X] Please provide as much detail as possible.

~~~
Version info:
[WARN]    Your install is out of date: 361732bfc203c8476c8baf4e6663963b53099cf6 (Thu, 15 Sep 2016 10:36:55 +0000)
[WARN]    Your local git branch is not master, this will prevent automatic updates.
DB Schema: 118
PHP: 7.0.8-0ubuntu0.16.04.2
MySQL: 5.7.15-0ubuntu0.16.04.1
RRDTool: 1.5.5
SNMP: NET-SNMP version: 5.7.3
~~~

It is possible to add devices which are not currently online using `addhost.php -f` or the Force Add checkbox in the GUI (see also #4453); or a device which was originally OK may be temporarily offline.

However when you then run the "discovery" phase it is extremely slow, as librenms times out making many failed queries to the unreachable device(s).

To replicate, start with an empty librenms install. Create one down device (this takes one minute)

~~~
$ time php addhost.php -f 1.2.3.4 foobar
Added device 1.2.3.4 (1)

real	1m0.696s
user	0m0.456s
sys	0m0.148s
~~~

Now try to run discovery: it takes over five and a half minutes!

~~~
$ time ./discovery.php -h all
LibreNMS Discovery
Version info:
Commit SHA: 361732bfc203c8476c8baf4e6663963b53099cf6
DB Schema: 118
PHP: 7.0.8-0ubuntu0.16.04.2
MySQL: 5.7.15-0ubuntu0.16.04.1
RRDTool: 1.5.5
SNMP: NET-SNMP version: 5.7.3

1.2.3.4 1 generic
#### Load disco module os ####
Changed Icon! : generic

>> Runtime for discovery module 'os': 54.77 seconds
#### Unload disco module os ####

#### Load disco module ports ####


>> Runtime for discovery module 'ports': 18.22 seconds
#### Unload disco module ports ####

#### Load disco module ports-stack ####


>> Runtime for discovery module 'ports-stack': 6.096 seconds
#### Unload disco module ports-stack ####

#### Load disco module entity-physical ####

Caching OIDs: entPhysicalEntry entAliasMappingIdentifier

>> Runtime for discovery module 'entity-physical': 12.14 seconds
#### Unload disco module entity-physical ####

#### Load disco module processors ####
 hrDevice:

>> Runtime for discovery module 'processors': 12.16 seconds
#### Unload disco module processors ####

#### Load disco module mempools ####


>> Runtime for discovery module 'mempools': 18.23 seconds
#### Unload disco module mempools ####

#### Load disco module cisco-vrf-lite ####

>> Runtime for discovery module 'cisco-vrf-lite': 0.001 seconds
#### Unload disco module cisco-vrf-lite ####

#### Load disco module ipv4-addresses ####
!

>> Runtime for discovery module 'ipv4-addresses': 12.16 seconds
#### Unload disco module ipv4-addresses ####

#### Load disco module ipv6-addresses ####


>> Runtime for discovery module 'ipv6-addresses': 12.26 seconds
#### Unload disco module ipv6-addresses ####

Module [ route ] disabled globally.

#### Load disco module sensors ####
Pre-cache:
 ENTITY-SENSOR: Caching OIDs: entPhySensorType entPhySensorScale entPhySensorPrecision entPhySensorValue
Temperatures:
Humidity :
Voltages:
Frequencies:
Current:
Power:
Fanspeeds :
Battery Charge:
Load:
States:
dBm:
Signal:

>> Runtime for discovery module 'sensors': 56.53 seconds
#### Unload disco module sensors ####

#### Load disco module storage ####


>> Runtime for discovery module 'storage': 18.65 seconds
#### Unload disco module storage ####

#### Load disco module hr-device ####


>> Runtime for discovery module 'hr-device': 12.29 seconds
#### Unload disco module hr-device ####

#### Load disco module discovery-protocols ####
 CISCO-CDP-MIB:  LLDP-MIB:  OSPF Discovery: enabled


>> Runtime for discovery module 'discovery-protocols': 18.46 seconds
#### Unload disco module discovery-protocols ####

#### Load disco module arp-table ####


>> Runtime for discovery module 'arp-table': 6.142 seconds
#### Unload disco module arp-table ####

Module [ discovery-arp ] disabled globally.

#### Load disco module junose-atm-vp ####

>> Runtime for discovery module 'junose-atm-vp': 0.000 seconds
#### Unload disco module junose-atm-vp ####

#### Load disco module bgp-peers ####
No BGP on host
FIN BGP



>> Runtime for discovery module 'bgp-peers': 6.133 seconds
#### Unload disco module bgp-peers ####

#### Load disco module vlans ####
IEEE8021-Q-BRIDGE-MIB VLANs :

>> Runtime for discovery module 'vlans': 6.213 seconds
#### Unload disco module vlans ####

#### Load disco module cisco-mac-accounting ####

>> Runtime for discovery module 'cisco-mac-accounting': 0.003 seconds
#### Unload disco module cisco-mac-accounting ####

#### Load disco module cisco-pw ####

>> Runtime for discovery module 'cisco-pw': 0.000 seconds
#### Unload disco module cisco-pw ####

#### Load disco module cisco-vrf ####

>> Runtime for discovery module 'cisco-vrf': 0.000 seconds
#### Unload disco module cisco-vrf ####

#### Load disco module cisco-sla ####

>> Runtime for discovery module 'cisco-sla': 0.000 seconds
#### Unload disco module cisco-sla ####

#### Load disco module vmware-vminfo ####

>> Runtime for discovery module 'vmware-vminfo': 0.000 seconds
#### Unload disco module vmware-vminfo ####

#### Load disco module libvirt-vminfo ####

>> Runtime for discovery module 'libvirt-vminfo': 0.000 seconds
#### Unload disco module libvirt-vminfo ####

#### Load disco module toner ####


>> Runtime for discovery module 'toner': 0.016 seconds
#### Unload disco module toner ####

#### Load disco module ucd-diskio ####


>> Runtime for discovery module 'ucd-diskio': 6.235 seconds
#### Unload disco module ucd-diskio ####

#### Load disco module services ####

>> Runtime for discovery module 'services': 0.000 seconds
#### Unload disco module services ####

#### Load disco module charge ####

>> Runtime for discovery module 'charge': 0.003 seconds
#### Unload disco module charge ####

Module [ cisco-cbqos ] disabled globally.

#### Load disco module stp ####


>> Runtime for discovery module 'stp': 6.136 seconds
#### Unload disco module stp ####

#### Load disco module cisco-otv ####

>> Runtime for discovery module 'cisco-otv': 0.000 seconds
#### Unload disco module cisco-otv ####

#### Load disco module ntp ####

>> Runtime for discovery module 'ntp': 0.000 seconds
#### Unload disco module ntp ####

Discovered in 337.7 seconds

MySQL: Cell[1/0s] Row[10/0.01s] Rows[30/0.11s] Column[0/0s] Update[2/0.01s] Insert[2/0s] Delete[0/0s]

real	5m38.049s
user	0m3.360s
sys	0m0.740s
~~~

Running `tcpdump -i eth0 -nn host 1.2.3.4` while the discovery is running shows 330 failed SNMP queries (note: the tcpdump below does *not* include the queries from addhost.php)

~~~
08:21:53.076295 IP 10.10.9.36.49910 > 1.2.3.4.161:  C=foobar GetRequest(28)  .1.3.6.1.2.1.1.1.0
08:21:54.077436 IP 10.10.9.36.49910 > 1.2.3.4.161:  C=foobar GetRequest(28)  .1.3.6.1.2.1.1.1.0
08:21:55.077924 IP 10.10.9.36.49910 > 1.2.3.4.161:  C=foobar GetRequest(28)  .1.3.6.1.2.1.1.1.0
08:21:56.079042 IP 10.10.9.36.49910 > 1.2.3.4.161:  C=foobar GetRequest(28)  .1.3.6.1.2.1.1.1.0
08:21:57.080017 IP 10.10.9.36.49910 > 1.2.3.4.161:  C=foobar GetRequest(28)  .1.3.6.1.2.1.1.1.0
08:21:58.080208 IP 10.10.9.36.49910 > 1.2.3.4.161:  C=foobar GetRequest(28)  .1.3.6.1.2.1.1.1.0
08:21:59.167411 IP 10.10.9.36.37012 > 1.2.3.4.161:  C=foobar GetRequest(28)  .1.3.6.1.2.1.1.2.0
08:22:00.168510 IP 10.10.9.36.37012 > 1.2.3.4.161:  C=foobar GetRequest(28)  .1.3.6.1.2.1.1.2.0
08:22:01.169348 IP 10.10.9.36.37012 > 1.2.3.4.161:  C=foobar GetRequest(28)  .1.3.6.1.2.1.1.2.0
08:22:02.170442 IP 10.10.9.36.37012 > 1.2.3.4.161:  C=foobar GetRequest(28)  .1.3.6.1.2.1.1.2.0
08:22:03.171422 IP 10.10.9.36.37012 > 1.2.3.4.161:  C=foobar GetRequest(28)  .1.3.6.1.2.1.1.2.0
08:22:04.172024 IP 10.10.9.36.37012 > 1.2.3.4.161:  C=foobar GetRequest(28)  .1.3.6.1.2.1.1.2.0
08:22:05.246777 IP 10.10.9.36.52101 > 1.2.3.4.161:  C=foobar GetRequest(32)  .1.3.6.1.2.1.47.1.1.1.1.2.1
08:22:06.247889 IP 10.10.9.36.52101 > 1.2.3.4.161:  C=foobar GetRequest(32)  .1.3.6.1.2.1.47.1.1.1.1.2.1
08:22:07.248999 IP 10.10.9.36.52101 > 1.2.3.4.161:  C=foobar GetRequest(32)  .1.3.6.1.2.1.47.1.1.1.1.2.1
08:22:08.249535 IP 10.10.9.36.52101 > 1.2.3.4.161:  C=foobar GetRequest(32)  .1.3.6.1.2.1.47.1.1.1.1.2.1
08:22:09.250734 IP 10.10.9.36.52101 > 1.2.3.4.161:  C=foobar GetRequest(32)  .1.3.6.1.2.1.47.1.1.1.1.2.1
08:22:10.251297 IP 10.10.9.36.52101 > 1.2.3.4.161:  C=foobar GetRequest(32)  .1.3.6.1.2.1.47.1.1.1.1.2.1
08:22:11.335523 IP 10.10.9.36.36546 > 1.2.3.4.161:  C=foobar GetRequest(31)  .1.3.6.1.4.1.6050.1.1.2.0
08:22:12.336581 IP 10.10.9.36.36546 > 1.2.3.4.161:  C=foobar GetRequest(31)  .1.3.6.1.4.1.6050.1.1.2.0
08:22:13.337694 IP 10.10.9.36.36546 > 1.2.3.4.161:  C=foobar GetRequest(31)  .1.3.6.1.4.1.6050.1.1.2.0
08:22:14.338859 IP 10.10.9.36.36546 > 1.2.3.4.161:  C=foobar GetRequest(31)  .1.3.6.1.4.1.6050.1.1.2.0
08:22:15.340030 IP 10.10.9.36.36546 > 1.2.3.4.161:  C=foobar GetRequest(31)  .1.3.6.1.4.1.6050.1.1.2.0
08:22:16.341223 IP 10.10.9.36.36546 > 1.2.3.4.161:  C=foobar GetRequest(31)  .1.3.6.1.4.1.6050.1.1.2.0
08:22:17.424238 IP 10.10.9.36.36827 > 1.2.3.4.161:  C=foobar GetRequest(31)  .1.3.6.1.4.1.39165.1.6.0
08:22:18.425382 IP 10.10.9.36.36827 > 1.2.3.4.161:  C=foobar GetRequest(31)  .1.3.6.1.4.1.39165.1.6.0
08:22:19.426533 IP 10.10.9.36.36827 > 1.2.3.4.161:  C=foobar GetRequest(31)  .1.3.6.1.4.1.39165.1.6.0
08:22:20.427208 IP 10.10.9.36.36827 > 1.2.3.4.161:  C=foobar GetRequest(31)  .1.3.6.1.4.1.39165.1.6.0
08:22:21.428401 IP 10.10.9.36.36827 > 1.2.3.4.161:  C=foobar GetRequest(31)  .1.3.6.1.4.1.39165.1.6.0
08:22:22.429593 IP 10.10.9.36.36827 > 1.2.3.4.161:  C=foobar GetRequest(31)  .1.3.6.1.4.1.39165.1.6.0
08:22:23.526533 IP 10.10.9.36.49806 > 1.2.3.4.161:  C=foobar GetRequest(33)  .1.3.6.1.4.1.2.6.182.3.3.1.0
08:22:24.527682 IP 10.10.9.36.49806 > 1.2.3.4.161:  C=foobar GetRequest(33)  .1.3.6.1.4.1.2.6.182.3.3.1.0
08:22:25.528820 IP 10.10.9.36.49806 > 1.2.3.4.161:  C=foobar GetRequest(33)  .1.3.6.1.4.1.2.6.182.3.3.1.0
08:22:26.530007 IP 10.10.9.36.49806 > 1.2.3.4.161:  C=foobar GetRequest(33)  .1.3.6.1.4.1.2.6.182.3.3.1.0
08:22:27.531155 IP 10.10.9.36.49806 > 1.2.3.4.161:  C=foobar GetRequest(33)  .1.3.6.1.4.1.2.6.182.3.3.1.0
08:22:28.532301 IP 10.10.9.36.49806 > 1.2.3.4.161:  C=foobar GetRequest(33)  .1.3.6.1.4.1.2.6.182.3.3.1.0
08:22:29.621226 IP 10.10.9.36.58192 > 1.2.3.4.161:  C=foobar GetRequest(36)  .1.3.6.1.4.1.674.10895.3000.1.2.100.1.0
08:22:30.621465 IP 10.10.9.36.58192 > 1.2.3.4.161:  C=foobar GetRequest(36)  .1.3.6.1.4.1.674.10895.3000.1.2.100.1.0
08:22:31.623164 IP 10.10.9.36.58192 > 1.2.3.4.161:  C=foobar GetRequest(36)  .1.3.6.1.4.1.674.10895.3000.1.2.100.1.0
08:22:32.624335 IP 10.10.9.36.58192 > 1.2.3.4.161:  C=foobar GetRequest(36)  .1.3.6.1.4.1.674.10895.3000.1.2.100.1.0
08:22:33.624966 IP 10.10.9.36.58192 > 1.2.3.4.161:  C=foobar GetRequest(36)  .1.3.6.1.4.1.674.10895.3000.1.2.100.1.0
08:22:34.625468 IP 10.10.9.36.58192 > 1.2.3.4.161:  C=foobar GetRequest(36)  .1.3.6.1.4.1.674.10895.3000.1.2.100.1.0
08:22:35.724268 IP 10.10.9.36.38720 > 1.2.3.4.161:  C=foobar GetRequest(32)  .1.3.6.1.2.1.47.1.1.1.1.12.1
08:22:36.725457 IP 10.10.9.36.38720 > 1.2.3.4.161:  C=foobar GetRequest(32)  .1.3.6.1.2.1.47.1.1.1.1.12.1
08:22:37.726636 IP 10.10.9.36.38720 > 1.2.3.4.161:  C=foobar GetRequest(32)  .1.3.6.1.2.1.47.1.1.1.1.12.1
08:22:38.727848 IP 10.10.9.36.38720 > 1.2.3.4.161:  C=foobar GetRequest(32)  .1.3.6.1.2.1.47.1.1.1.1.12.1
08:22:39.729014 IP 10.10.9.36.38720 > 1.2.3.4.161:  C=foobar GetRequest(32)  .1.3.6.1.2.1.47.1.1.1.1.12.1
08:22:40.729545 IP 10.10.9.36.38720 > 1.2.3.4.161:  C=foobar GetRequest(32)  .1.3.6.1.2.1.47.1.1.1.1.12.1
08:22:41.824779 IP 10.10.9.36.53464 > 1.2.3.4.161:  C=foobar GetRequest(28)  .1.3.6.1.2.1.1.5.0
08:22:42.825550 IP 10.10.9.36.53464 > 1.2.3.4.161:  C=foobar GetRequest(28)  .1.3.6.1.2.1.1.5.0
08:22:43.826794 IP 10.10.9.36.53464 > 1.2.3.4.161:  C=foobar GetRequest(28)  .1.3.6.1.2.1.1.5.0
08:22:44.827984 IP 10.10.9.36.53464 > 1.2.3.4.161:  C=foobar GetRequest(28)  .1.3.6.1.2.1.1.5.0
08:22:45.829145 IP 10.10.9.36.53464 > 1.2.3.4.161:  C=foobar GetRequest(28)  .1.3.6.1.2.1.1.5.0
08:22:46.829942 IP 10.10.9.36.53464 > 1.2.3.4.161:  C=foobar GetRequest(28)  .1.3.6.1.2.1.1.5.0
08:22:47.905829 IP 10.10.9.36.48093 > 1.2.3.4.161:  C=foobar GetRequest(28)  .1.3.6.1.2.1.1.1.0
08:22:48.906974 IP 10.10.9.36.48093 > 1.2.3.4.161:  C=foobar GetRequest(28)  .1.3.6.1.2.1.1.1.0
08:22:49.908132 IP 10.10.9.36.48093 > 1.2.3.4.161:  C=foobar GetRequest(28)  .1.3.6.1.2.1.1.1.0
08:22:50.909369 IP 10.10.9.36.48093 > 1.2.3.4.161:  C=foobar GetRequest(28)  .1.3.6.1.2.1.1.1.0
08:22:51.910563 IP 10.10.9.36.48093 > 1.2.3.4.161:  C=foobar GetRequest(28)  .1.3.6.1.2.1.1.1.0
08:22:52.911776 IP 10.10.9.36.48093 > 1.2.3.4.161:  C=foobar GetRequest(28)  .1.3.6.1.2.1.1.1.0
08:22:54.001005 IP 10.10.9.36.33414 > 1.2.3.4.161:  C=foobar GetRequest(28)  .1.3.6.1.2.1.1.2.0
08:22:55.001389 IP 10.10.9.36.33414 > 1.2.3.4.161:  C=foobar GetRequest(28)  .1.3.6.1.2.1.1.2.0
08:22:56.002504 IP 10.10.9.36.33414 > 1.2.3.4.161:  C=foobar GetRequest(28)  .1.3.6.1.2.1.1.2.0
08:22:57.003638 IP 10.10.9.36.33414 > 1.2.3.4.161:  C=foobar GetRequest(28)  .1.3.6.1.2.1.1.2.0
08:22:58.004241 IP 10.10.9.36.33414 > 1.2.3.4.161:  C=foobar GetRequest(28)  .1.3.6.1.2.1.1.2.0
08:22:59.005378 IP 10.10.9.36.33414 > 1.2.3.4.161:  C=foobar GetRequest(28)  .1.3.6.1.2.1.1.2.0
08:23:00.076277 IP 10.10.9.36.40416 > 1.2.3.4.161:  C=foobar GetRequest(32)  .1.3.6.1.2.1.47.1.1.1.1.2.1
08:23:01.077366 IP 10.10.9.36.40416 > 1.2.3.4.161:  C=foobar GetRequest(32)  .1.3.6.1.2.1.47.1.1.1.1.2.1
08:23:02.078457 IP 10.10.9.36.40416 > 1.2.3.4.161:  C=foobar GetRequest(32)  .1.3.6.1.2.1.47.1.1.1.1.2.1
08:23:03.078867 IP 10.10.9.36.40416 > 1.2.3.4.161:  C=foobar GetRequest(32)  .1.3.6.1.2.1.47.1.1.1.1.2.1
08:23:04.080022 IP 10.10.9.36.40416 > 1.2.3.4.161:  C=foobar GetRequest(32)  .1.3.6.1.2.1.47.1.1.1.1.2.1
08:23:05.081164 IP 10.10.9.36.40416 > 1.2.3.4.161:  C=foobar GetRequest(32)  .1.3.6.1.2.1.47.1.1.1.1.2.1
08:23:06.174359 IP 10.10.9.36.37330 > 1.2.3.4.161:  C=foobar GetRequest(31)  .1.3.6.1.4.1.6050.1.1.2.0
08:23:07.175365 IP 10.10.9.36.37330 > 1.2.3.4.161:  C=foobar GetRequest(31)  .1.3.6.1.4.1.6050.1.1.2.0
08:23:08.176268 IP 10.10.9.36.37330 > 1.2.3.4.161:  C=foobar GetRequest(31)  .1.3.6.1.4.1.6050.1.1.2.0
08:23:09.176476 IP 10.10.9.36.37330 > 1.2.3.4.161:  C=foobar GetRequest(31)  .1.3.6.1.4.1.6050.1.1.2.0
08:23:10.176886 IP 10.10.9.36.37330 > 1.2.3.4.161:  C=foobar GetRequest(31)  .1.3.6.1.4.1.6050.1.1.2.0
08:23:11.177500 IP 10.10.9.36.37330 > 1.2.3.4.161:  C=foobar GetRequest(31)  .1.3.6.1.4.1.6050.1.1.2.0
08:23:12.241358 IP 10.10.9.36.44891 > 1.2.3.4.161:  C=foobar GetRequest(31)  .1.3.6.1.4.1.39165.1.6.0
08:23:13.241526 IP 10.10.9.36.44891 > 1.2.3.4.161:  C=foobar GetRequest(31)  .1.3.6.1.4.1.39165.1.6.0
08:23:14.242008 IP 10.10.9.36.44891 > 1.2.3.4.161:  C=foobar GetRequest(31)  .1.3.6.1.4.1.39165.1.6.0
08:23:15.242876 IP 10.10.9.36.44891 > 1.2.3.4.161:  C=foobar GetRequest(31)  .1.3.6.1.4.1.39165.1.6.0
08:23:16.244030 IP 10.10.9.36.44891 > 1.2.3.4.161:  C=foobar GetRequest(31)  .1.3.6.1.4.1.39165.1.6.0
08:23:17.245196 IP 10.10.9.36.44891 > 1.2.3.4.161:  C=foobar GetRequest(31)  .1.3.6.1.4.1.39165.1.6.0
08:23:18.303910 IP 10.10.9.36.39407 > 1.2.3.4.161:  C=foobar GetRequest(33)  .1.3.6.1.4.1.2.6.182.3.3.1.0
08:23:19.305039 IP 10.10.9.36.39407 > 1.2.3.4.161:  C=foobar GetRequest(33)  .1.3.6.1.4.1.2.6.182.3.3.1.0
08:23:20.305408 IP 10.10.9.36.39407 > 1.2.3.4.161:  C=foobar GetRequest(33)  .1.3.6.1.4.1.2.6.182.3.3.1.0
08:23:21.305674 IP 10.10.9.36.39407 > 1.2.3.4.161:  C=foobar GetRequest(33)  .1.3.6.1.4.1.2.6.182.3.3.1.0
08:23:22.306523 IP 10.10.9.36.39407 > 1.2.3.4.161:  C=foobar GetRequest(33)  .1.3.6.1.4.1.2.6.182.3.3.1.0
08:23:23.307626 IP 10.10.9.36.39407 > 1.2.3.4.161:  C=foobar GetRequest(33)  .1.3.6.1.4.1.2.6.182.3.3.1.0
08:23:24.404587 IP 10.10.9.36.33036 > 1.2.3.4.161:  C=foobar GetRequest(36)  .1.3.6.1.4.1.674.10895.3000.1.2.100.1.0
08:23:25.405756 IP 10.10.9.36.33036 > 1.2.3.4.161:  C=foobar GetRequest(36)  .1.3.6.1.4.1.674.10895.3000.1.2.100.1.0
08:23:26.406919 IP 10.10.9.36.33036 > 1.2.3.4.161:  C=foobar GetRequest(36)  .1.3.6.1.4.1.674.10895.3000.1.2.100.1.0
08:23:27.408135 IP 10.10.9.36.33036 > 1.2.3.4.161:  C=foobar GetRequest(36)  .1.3.6.1.4.1.674.10895.3000.1.2.100.1.0
08:23:28.409332 IP 10.10.9.36.33036 > 1.2.3.4.161:  C=foobar GetRequest(36)  .1.3.6.1.4.1.674.10895.3000.1.2.100.1.0
08:23:29.410496 IP 10.10.9.36.33036 > 1.2.3.4.161:  C=foobar GetRequest(36)  .1.3.6.1.4.1.674.10895.3000.1.2.100.1.0
08:23:30.501358 IP 10.10.9.36.56784 > 1.2.3.4.161:  C=foobar GetRequest(32)  .1.3.6.1.2.1.47.1.1.1.1.12.1
08:23:31.502508 IP 10.10.9.36.56784 > 1.2.3.4.161:  C=foobar GetRequest(32)  .1.3.6.1.2.1.47.1.1.1.1.12.1
08:23:32.503686 IP 10.10.9.36.56784 > 1.2.3.4.161:  C=foobar GetRequest(32)  .1.3.6.1.2.1.47.1.1.1.1.12.1
08:23:33.504524 IP 10.10.9.36.56784 > 1.2.3.4.161:  C=foobar GetRequest(32)  .1.3.6.1.2.1.47.1.1.1.1.12.1
08:23:34.505642 IP 10.10.9.36.56784 > 1.2.3.4.161:  C=foobar GetRequest(32)  .1.3.6.1.2.1.47.1.1.1.1.12.1
08:23:35.506812 IP 10.10.9.36.56784 > 1.2.3.4.161:  C=foobar GetRequest(32)  .1.3.6.1.2.1.47.1.1.1.1.12.1
08:23:36.594000 IP 10.10.9.36.55251 > 1.2.3.4.161:  C=foobar GetRequest(28)  .1.3.6.1.2.1.1.5.0
08:23:37.595135 IP 10.10.9.36.55251 > 1.2.3.4.161:  C=foobar GetRequest(28)  .1.3.6.1.2.1.1.5.0
08:23:38.596293 IP 10.10.9.36.55251 > 1.2.3.4.161:  C=foobar GetRequest(28)  .1.3.6.1.2.1.1.5.0
08:23:39.597435 IP 10.10.9.36.55251 > 1.2.3.4.161:  C=foobar GetRequest(28)  .1.3.6.1.2.1.1.5.0
08:23:40.597677 IP 10.10.9.36.55251 > 1.2.3.4.161:  C=foobar GetRequest(28)  .1.3.6.1.2.1.1.5.0
08:23:41.598852 IP 10.10.9.36.55251 > 1.2.3.4.161:  C=foobar GetRequest(28)  .1.3.6.1.2.1.1.5.0
08:23:42.675616 IP 10.10.9.36.35031 > 1.2.3.4.161:  C=foobar GetBulk(29)  N=0 M=10 .1.3.6.1.2.1.2.2.1.2
08:23:43.676781 IP 10.10.9.36.35031 > 1.2.3.4.161:  C=foobar GetBulk(29)  N=0 M=10 .1.3.6.1.2.1.2.2.1.2
08:23:44.677959 IP 10.10.9.36.35031 > 1.2.3.4.161:  C=foobar GetBulk(29)  N=0 M=10 .1.3.6.1.2.1.2.2.1.2
08:23:45.679131 IP 10.10.9.36.35031 > 1.2.3.4.161:  C=foobar GetBulk(29)  N=0 M=10 .1.3.6.1.2.1.2.2.1.2
08:23:46.680283 IP 10.10.9.36.35031 > 1.2.3.4.161:  C=foobar GetBulk(29)  N=0 M=10 .1.3.6.1.2.1.2.2.1.2
08:23:47.681447 IP 10.10.9.36.35031 > 1.2.3.4.161:  C=foobar GetBulk(29)  N=0 M=10 .1.3.6.1.2.1.2.2.1.2
08:23:48.739928 IP 10.10.9.36.51474 > 1.2.3.4.161:  C=foobar GetBulk(30)  N=0 M=10 .1.3.6.1.2.1.31.1.1.1.1
08:23:49.740570 IP 10.10.9.36.51474 > 1.2.3.4.161:  C=foobar GetBulk(30)  N=0 M=10 .1.3.6.1.2.1.31.1.1.1.1
08:23:50.741478 IP 10.10.9.36.51474 > 1.2.3.4.161:  C=foobar GetBulk(30)  N=0 M=10 .1.3.6.1.2.1.31.1.1.1.1
08:23:51.742676 IP 10.10.9.36.51474 > 1.2.3.4.161:  C=foobar GetBulk(30)  N=0 M=10 .1.3.6.1.2.1.31.1.1.1.1
08:23:52.743877 IP 10.10.9.36.51474 > 1.2.3.4.161:  C=foobar GetBulk(30)  N=0 M=10 .1.3.6.1.2.1.31.1.1.1.1
08:23:53.744513 IP 10.10.9.36.51474 > 1.2.3.4.161:  C=foobar GetBulk(30)  N=0 M=10 .1.3.6.1.2.1.31.1.1.1.1
08:23:54.818640 IP 10.10.9.36.33473 > 1.2.3.4.161:  C=foobar GetBulk(29)  N=0 M=10 .1.3.6.1.2.1.2.2.1.3
08:23:55.819804 IP 10.10.9.36.33473 > 1.2.3.4.161:  C=foobar GetBulk(29)  N=0 M=10 .1.3.6.1.2.1.2.2.1.3
08:23:56.820974 IP 10.10.9.36.33473 > 1.2.3.4.161:  C=foobar GetBulk(29)  N=0 M=10 .1.3.6.1.2.1.2.2.1.3
08:23:57.821496 IP 10.10.9.36.33473 > 1.2.3.4.161:  C=foobar GetBulk(29)  N=0 M=10 .1.3.6.1.2.1.2.2.1.3
08:23:58.822706 IP 10.10.9.36.33473 > 1.2.3.4.161:  C=foobar GetBulk(29)  N=0 M=10 .1.3.6.1.2.1.2.2.1.3
08:23:59.823922 IP 10.10.9.36.33473 > 1.2.3.4.161:  C=foobar GetBulk(29)  N=0 M=10 .1.3.6.1.2.1.2.2.1.3
08:24:00.918370 IP 10.10.9.36.47416 > 1.2.3.4.161:  C=foobar GetBulk(30)  N=0 M=10 .1.3.6.1.2.1.31.1.2.1.3
08:24:01.918858 IP 10.10.9.36.47416 > 1.2.3.4.161:  C=foobar GetBulk(30)  N=0 M=10 .1.3.6.1.2.1.31.1.2.1.3
08:24:02.920006 IP 10.10.9.36.47416 > 1.2.3.4.161:  C=foobar GetBulk(30)  N=0 M=10 .1.3.6.1.2.1.31.1.2.1.3
08:24:03.921242 IP 10.10.9.36.47416 > 1.2.3.4.161:  C=foobar GetBulk(30)  N=0 M=10 .1.3.6.1.2.1.31.1.2.1.3
08:24:04.922469 IP 10.10.9.36.47416 > 1.2.3.4.161:  C=foobar GetBulk(30)  N=0 M=10 .1.3.6.1.2.1.31.1.2.1.3
08:24:05.923668 IP 10.10.9.36.47416 > 1.2.3.4.161:  C=foobar GetBulk(30)  N=0 M=10 .1.3.6.1.2.1.31.1.2.1.3
08:24:07.005867 IP 10.10.9.36.46123 > 1.2.3.4.161:  C=foobar GetBulk(30)  N=0 M=10 .1.3.6.1.2.1.47.1.1.1.1
08:24:08.006956 IP 10.10.9.36.46123 > 1.2.3.4.161:  C=foobar GetBulk(30)  N=0 M=10 .1.3.6.1.2.1.47.1.1.1.1
08:24:09.008050 IP 10.10.9.36.46123 > 1.2.3.4.161:  C=foobar GetBulk(30)  N=0 M=10 .1.3.6.1.2.1.47.1.1.1.1
08:24:10.009135 IP 10.10.9.36.46123 > 1.2.3.4.161:  C=foobar GetBulk(30)  N=0 M=10 .1.3.6.1.2.1.47.1.1.1.1
08:24:11.009407 IP 10.10.9.36.46123 > 1.2.3.4.161:  C=foobar GetBulk(30)  N=0 M=10 .1.3.6.1.2.1.47.1.1.1.1
08:24:12.010657 IP 10.10.9.36.46123 > 1.2.3.4.161:  C=foobar GetBulk(30)  N=0 M=10 .1.3.6.1.2.1.47.1.1.1.1
08:24:13.058584 IP 10.10.9.36.48350 > 1.2.3.4.161:  C=foobar GetBulk(31)  N=0 M=10 .1.3.6.1.2.1.47.1.3.2.1.2
08:24:14.058852 IP 10.10.9.36.48350 > 1.2.3.4.161:  C=foobar GetBulk(31)  N=0 M=10 .1.3.6.1.2.1.47.1.3.2.1.2
08:24:15.060006 IP 10.10.9.36.48350 > 1.2.3.4.161:  C=foobar GetBulk(31)  N=0 M=10 .1.3.6.1.2.1.47.1.3.2.1.2
08:24:16.061156 IP 10.10.9.36.48350 > 1.2.3.4.161:  C=foobar GetBulk(31)  N=0 M=10 .1.3.6.1.2.1.47.1.3.2.1.2
08:24:17.061450 IP 10.10.9.36.48350 > 1.2.3.4.161:  C=foobar GetBulk(31)  N=0 M=10 .1.3.6.1.2.1.47.1.3.2.1.2
08:24:18.062621 IP 10.10.9.36.48350 > 1.2.3.4.161:  C=foobar GetBulk(31)  N=0 M=10 .1.3.6.1.2.1.47.1.3.2.1.2
08:24:19.144005 IP 10.10.9.36.53113 > 1.2.3.4.161:  C=foobar GetBulk(27)  N=0 M=10 .1.3.6.1.2.1.25.3
08:24:20.145156 IP 10.10.9.36.53113 > 1.2.3.4.161:  C=foobar GetBulk(27)  N=0 M=10 .1.3.6.1.2.1.25.3
08:24:21.146313 IP 10.10.9.36.53113 > 1.2.3.4.161:  C=foobar GetBulk(27)  N=0 M=10 .1.3.6.1.2.1.25.3
08:24:22.147500 IP 10.10.9.36.53113 > 1.2.3.4.161:  C=foobar GetBulk(27)  N=0 M=10 .1.3.6.1.2.1.25.3
08:24:23.148675 IP 10.10.9.36.53113 > 1.2.3.4.161:  C=foobar GetBulk(27)  N=0 M=10 .1.3.6.1.2.1.25.3
08:24:24.149548 IP 10.10.9.36.53113 > 1.2.3.4.161:  C=foobar GetBulk(27)  N=0 M=10 .1.3.6.1.2.1.25.3
08:24:25.219153 IP 10.10.9.36.39726 > 1.2.3.4.161:  C=foobar GetBulk(30)  N=0 M=10 .1.3.6.1.2.1.25.3.3.1.2
08:24:26.220278 IP 10.10.9.36.39726 > 1.2.3.4.161:  C=foobar GetBulk(30)  N=0 M=10 .1.3.6.1.2.1.25.3.3.1.2
08:24:27.221453 IP 10.10.9.36.39726 > 1.2.3.4.161:  C=foobar GetBulk(30)  N=0 M=10 .1.3.6.1.2.1.25.3.3.1.2
08:24:28.222608 IP 10.10.9.36.39726 > 1.2.3.4.161:  C=foobar GetBulk(30)  N=0 M=10 .1.3.6.1.2.1.25.3.3.1.2
08:24:29.223788 IP 10.10.9.36.39726 > 1.2.3.4.161:  C=foobar GetBulk(30)  N=0 M=10 .1.3.6.1.2.1.25.3.3.1.2
08:24:30.224953 IP 10.10.9.36.39726 > 1.2.3.4.161:  C=foobar GetBulk(30)  N=0 M=10 .1.3.6.1.2.1.25.3.3.1.2
08:24:31.285332 IP 10.10.9.36.34802 > 1.2.3.4.161:  C=foobar GetBulk(29)  N=0 M=10 .1.3.6.1.2.1.25.2.3.1
08:24:32.285569 IP 10.10.9.36.34802 > 1.2.3.4.161:  C=foobar GetBulk(29)  N=0 M=10 .1.3.6.1.2.1.25.2.3.1
08:24:33.286727 IP 10.10.9.36.34802 > 1.2.3.4.161:  C=foobar GetBulk(29)  N=0 M=10 .1.3.6.1.2.1.25.2.3.1
08:24:34.287931 IP 10.10.9.36.34802 > 1.2.3.4.161:  C=foobar GetBulk(29)  N=0 M=10 .1.3.6.1.2.1.25.2.3.1
08:24:35.289095 IP 10.10.9.36.34802 > 1.2.3.4.161:  C=foobar GetBulk(29)  N=0 M=10 .1.3.6.1.2.1.25.2.3.1
08:24:36.290321 IP 10.10.9.36.34802 > 1.2.3.4.161:  C=foobar GetBulk(29)  N=0 M=10 .1.3.6.1.2.1.25.2.3.1
08:24:37.371938 IP 10.10.9.36.59104 > 1.2.3.4.161:  C=foobar GetBulk(34)  N=0 M=10 .1.3.6.1.4.1.11.2.14.11.5.1.1.2.1
08:24:38.372547 IP 10.10.9.36.59104 > 1.2.3.4.161:  C=foobar GetBulk(34)  N=0 M=10 .1.3.6.1.4.1.11.2.14.11.5.1.1.2.1
08:24:39.373459 IP 10.10.9.36.59104 > 1.2.3.4.161:  C=foobar GetBulk(34)  N=0 M=10 .1.3.6.1.4.1.11.2.14.11.5.1.1.2.1
08:24:40.374610 IP 10.10.9.36.59104 > 1.2.3.4.161:  C=foobar GetBulk(34)  N=0 M=10 .1.3.6.1.4.1.11.2.14.11.5.1.1.2.1
08:24:41.375361 IP 10.10.9.36.59104 > 1.2.3.4.161:  C=foobar GetBulk(34)  N=0 M=10 .1.3.6.1.4.1.11.2.14.11.5.1.1.2.1
08:24:42.375863 IP 10.10.9.36.59104 > 1.2.3.4.161:  C=foobar GetBulk(34)  N=0 M=10 .1.3.6.1.4.1.11.2.14.11.5.1.1.2.1
08:24:43.454291 IP 10.10.9.36.36868 > 1.2.3.4.161:  C=foobar GetBulk(34)  N=0 M=10 .1.3.6.1.4.1.11.2.14.11.5.1.1.2.2
08:24:44.455063 IP 10.10.9.36.36868 > 1.2.3.4.161:  C=foobar GetBulk(34)  N=0 M=10 .1.3.6.1.4.1.11.2.14.11.5.1.1.2.2
08:24:45.456235 IP 10.10.9.36.36868 > 1.2.3.4.161:  C=foobar GetBulk(34)  N=0 M=10 .1.3.6.1.4.1.11.2.14.11.5.1.1.2.2
08:24:46.457412 IP 10.10.9.36.36868 > 1.2.3.4.161:  C=foobar GetBulk(34)  N=0 M=10 .1.3.6.1.4.1.11.2.14.11.5.1.1.2.2
08:24:47.458554 IP 10.10.9.36.36868 > 1.2.3.4.161:  C=foobar GetBulk(34)  N=0 M=10 .1.3.6.1.4.1.11.2.14.11.5.1.1.2.2
08:24:48.458873 IP 10.10.9.36.36868 > 1.2.3.4.161:  C=foobar GetBulk(34)  N=0 M=10 .1.3.6.1.4.1.11.2.14.11.5.1.1.2.2
08:24:49.544555 IP 10.10.9.36.37399 > 1.2.3.4.161:  C=foobar GetBulk(29)  N=0 M=10 .1.3.6.1.2.1.4.20.1.2
08:24:50.545414 IP 10.10.9.36.37399 > 1.2.3.4.161:  C=foobar GetBulk(29)  N=0 M=10 .1.3.6.1.2.1.4.20.1.2
08:24:51.546633 IP 10.10.9.36.37399 > 1.2.3.4.161:  C=foobar GetBulk(29)  N=0 M=10 .1.3.6.1.2.1.4.20.1.2
08:24:52.547854 IP 10.10.9.36.37399 > 1.2.3.4.161:  C=foobar GetBulk(29)  N=0 M=10 .1.3.6.1.2.1.4.20.1.2
08:24:53.549034 IP 10.10.9.36.37399 > 1.2.3.4.161:  C=foobar GetBulk(29)  N=0 M=10 .1.3.6.1.2.1.4.20.1.2
08:24:54.550221 IP 10.10.9.36.37399 > 1.2.3.4.161:  C=foobar GetBulk(29)  N=0 M=10 .1.3.6.1.2.1.4.20.1.2
08:24:55.619017 IP 10.10.9.36.36738 > 1.2.3.4.161:  C=foobar GetRequest(30)  .1.3.6.1.2.1.4.20.1.3.0
08:24:56.620159 IP 10.10.9.36.36738 > 1.2.3.4.161:  C=foobar GetRequest(30)  .1.3.6.1.2.1.4.20.1.3.0
08:24:57.621293 IP 10.10.9.36.36738 > 1.2.3.4.161:  C=foobar GetRequest(30)  .1.3.6.1.2.1.4.20.1.3.0
08:24:58.621475 IP 10.10.9.36.36738 > 1.2.3.4.161:  C=foobar GetRequest(30)  .1.3.6.1.2.1.4.20.1.3.0
08:24:59.622654 IP 10.10.9.36.36738 > 1.2.3.4.161:  C=foobar GetRequest(30)  .1.3.6.1.2.1.4.20.1.3.0
08:25:00.623864 IP 10.10.9.36.36738 > 1.2.3.4.161:  C=foobar GetRequest(30)  .1.3.6.1.2.1.4.20.1.3.0
08:25:01.687044 IP 10.10.9.36.45730 > 1.2.3.4.161:  C=foobar GetBulk(30)  N=0 M=10 .1.3.6.1.2.1.4.34.1.3.2
08:25:02.687967 IP 10.10.9.36.45730 > 1.2.3.4.161:  C=foobar GetBulk(30)  N=0 M=10 .1.3.6.1.2.1.4.34.1.3.2
08:25:03.689166 IP 10.10.9.36.45730 > 1.2.3.4.161:  C=foobar GetBulk(30)  N=0 M=10 .1.3.6.1.2.1.4.34.1.3.2
08:25:04.693945 IP 10.10.9.36.45730 > 1.2.3.4.161:  C=foobar GetBulk(30)  N=0 M=10 .1.3.6.1.2.1.4.34.1.3.2
08:25:05.695067 IP 10.10.9.36.45730 > 1.2.3.4.161:  C=foobar GetBulk(30)  N=0 M=10 .1.3.6.1.2.1.4.34.1.3.2
08:25:06.696454 IP 10.10.9.36.45730 > 1.2.3.4.161:  C=foobar GetBulk(30)  N=0 M=10 .1.3.6.1.2.1.4.34.1.3.2
08:25:07.881860 IP 10.10.9.36.50303 > 1.2.3.4.161:  C=foobar GetBulk(30)  N=0 M=10 .1.3.6.1.2.1.55.1.8.1.2
08:25:08.883266 IP 10.10.9.36.50303 > 1.2.3.4.161:  C=foobar GetBulk(30)  N=0 M=10 .1.3.6.1.2.1.55.1.8.1.2
08:25:09.884662 IP 10.10.9.36.50303 > 1.2.3.4.161:  C=foobar GetBulk(30)  N=0 M=10 .1.3.6.1.2.1.55.1.8.1.2
08:25:10.885369 IP 10.10.9.36.50303 > 1.2.3.4.161:  C=foobar GetBulk(30)  N=0 M=10 .1.3.6.1.2.1.55.1.8.1.2
08:25:11.886784 IP 10.10.9.36.50303 > 1.2.3.4.161:  C=foobar GetBulk(30)  N=0 M=10 .1.3.6.1.2.1.55.1.8.1.2
08:25:12.887955 IP 10.10.9.36.50303 > 1.2.3.4.161:  C=foobar GetBulk(30)  N=0 M=10 .1.3.6.1.2.1.55.1.8.1.2
08:25:14.001000 IP 10.10.9.36.60262 > 1.2.3.4.161:  C=foobar GetBulk(30)  N=0 M=10 .1.3.6.1.2.1.99.1.1.1.1
08:25:15.002298 IP 10.10.9.36.60262 > 1.2.3.4.161:  C=foobar GetBulk(30)  N=0 M=10 .1.3.6.1.2.1.99.1.1.1.1
08:25:16.002722 IP 10.10.9.36.60262 > 1.2.3.4.161:  C=foobar GetBulk(30)  N=0 M=10 .1.3.6.1.2.1.99.1.1.1.1
08:25:17.005402 IP 10.10.9.36.60262 > 1.2.3.4.161:  C=foobar GetBulk(30)  N=0 M=10 .1.3.6.1.2.1.99.1.1.1.1
08:25:18.006829 IP 10.10.9.36.60262 > 1.2.3.4.161:  C=foobar GetBulk(30)  N=0 M=10 .1.3.6.1.2.1.99.1.1.1.1
08:25:19.007963 IP 10.10.9.36.60262 > 1.2.3.4.161:  C=foobar GetBulk(30)  N=0 M=10 .1.3.6.1.2.1.99.1.1.1.1
08:25:20.153661 IP 10.10.9.36.37193 > 1.2.3.4.161:  C=foobar GetBulk(30)  N=0 M=10 .1.3.6.1.2.1.99.1.1.1.2
08:25:21.159436 IP 10.10.9.36.37193 > 1.2.3.4.161:  C=foobar GetBulk(30)  N=0 M=10 .1.3.6.1.2.1.99.1.1.1.2
08:25:22.160889 IP 10.10.9.36.37193 > 1.2.3.4.161:  C=foobar GetBulk(30)  N=0 M=10 .1.3.6.1.2.1.99.1.1.1.2
08:25:23.161405 IP 10.10.9.36.37193 > 1.2.3.4.161:  C=foobar GetBulk(30)  N=0 M=10 .1.3.6.1.2.1.99.1.1.1.2
08:25:24.162922 IP 10.10.9.36.37193 > 1.2.3.4.161:  C=foobar GetBulk(30)  N=0 M=10 .1.3.6.1.2.1.99.1.1.1.2
08:25:25.164031 IP 10.10.9.36.37193 > 1.2.3.4.161:  C=foobar GetBulk(30)  N=0 M=10 .1.3.6.1.2.1.99.1.1.1.2
08:25:26.296733 IP 10.10.9.36.54677 > 1.2.3.4.161:  C=foobar GetBulk(30)  N=0 M=10 .1.3.6.1.2.1.99.1.1.1.3
08:25:27.302430 IP 10.10.9.36.54677 > 1.2.3.4.161:  C=foobar GetBulk(30)  N=0 M=10 .1.3.6.1.2.1.99.1.1.1.3
08:25:28.303434 IP 10.10.9.36.54677 > 1.2.3.4.161:  C=foobar GetBulk(30)  N=0 M=10 .1.3.6.1.2.1.99.1.1.1.3
08:25:29.304838 IP 10.10.9.36.54677 > 1.2.3.4.161:  C=foobar GetBulk(30)  N=0 M=10 .1.3.6.1.2.1.99.1.1.1.3
08:25:30.306337 IP 10.10.9.36.54677 > 1.2.3.4.161:  C=foobar GetBulk(30)  N=0 M=10 .1.3.6.1.2.1.99.1.1.1.3
08:25:31.307485 IP 10.10.9.36.54677 > 1.2.3.4.161:  C=foobar GetBulk(30)  N=0 M=10 .1.3.6.1.2.1.99.1.1.1.3
08:25:32.412636 IP 10.10.9.36.37421 > 1.2.3.4.161:  C=foobar GetBulk(30)  N=0 M=10 .1.3.6.1.2.1.99.1.1.1.4
08:25:33.413417 IP 10.10.9.36.37421 > 1.2.3.4.161:  C=foobar GetBulk(30)  N=0 M=10 .1.3.6.1.2.1.99.1.1.1.4
08:25:34.414907 IP 10.10.9.36.37421 > 1.2.3.4.161:  C=foobar GetBulk(30)  N=0 M=10 .1.3.6.1.2.1.99.1.1.1.4
08:25:35.415975 IP 10.10.9.36.37421 > 1.2.3.4.161:  C=foobar GetBulk(30)  N=0 M=10 .1.3.6.1.2.1.99.1.1.1.4
08:25:36.419476 IP 10.10.9.36.37421 > 1.2.3.4.161:  C=foobar GetBulk(30)  N=0 M=10 .1.3.6.1.2.1.99.1.1.1.4
08:25:37.419947 IP 10.10.9.36.37421 > 1.2.3.4.161:  C=foobar GetBulk(30)  N=0 M=10 .1.3.6.1.2.1.99.1.1.1.4
08:25:39.425095 IP 10.10.9.36.49207 > 1.2.3.4.161:  C=foobar GetRequest(29)  .1.3.6.1.2.1.25.1.4.0
08:25:40.425458 IP 10.10.9.36.49207 > 1.2.3.4.161:  C=foobar GetRequest(29)  .1.3.6.1.2.1.25.1.4.0
08:25:41.426051 IP 10.10.9.36.49207 > 1.2.3.4.161:  C=foobar GetRequest(29)  .1.3.6.1.2.1.25.1.4.0
08:25:42.426803 IP 10.10.9.36.49207 > 1.2.3.4.161:  C=foobar GetRequest(29)  .1.3.6.1.2.1.25.1.4.0
08:25:43.427962 IP 10.10.9.36.49207 > 1.2.3.4.161:  C=foobar GetRequest(29)  .1.3.6.1.2.1.25.1.4.0
08:25:44.429228 IP 10.10.9.36.49207 > 1.2.3.4.161:  C=foobar GetRequest(29)  .1.3.6.1.2.1.25.1.4.0
08:25:45.921054 IP 10.10.9.36.40696 > 1.2.3.4.161:  C=foobar GetRequest(29)  .1.3.6.1.2.1.25.1.4.0
08:25:46.923943 IP 10.10.9.36.40696 > 1.2.3.4.161:  C=foobar GetRequest(29)  .1.3.6.1.2.1.25.1.4.0
08:25:47.934873 IP 10.10.9.36.40696 > 1.2.3.4.161:  C=foobar GetRequest(29)  .1.3.6.1.2.1.25.1.4.0
08:25:48.939722 IP 10.10.9.36.40696 > 1.2.3.4.161:  C=foobar GetRequest(29)  .1.3.6.1.2.1.25.1.4.0
08:25:49.941353 IP 10.10.9.36.40696 > 1.2.3.4.161:  C=foobar GetRequest(29)  .1.3.6.1.2.1.25.1.4.0
08:25:50.944153 IP 10.10.9.36.40696 > 1.2.3.4.161:  C=foobar GetRequest(29)  .1.3.6.1.2.1.25.1.4.0
08:25:52.109820 IP 10.10.9.36.59520 > 1.2.3.4.161:  C=foobar GetRequest(29)  .1.3.6.1.2.1.25.1.4.0
08:25:53.110896 IP 10.10.9.36.59520 > 1.2.3.4.161:  C=foobar GetRequest(29)  .1.3.6.1.2.1.25.1.4.0
08:25:54.111963 IP 10.10.9.36.59520 > 1.2.3.4.161:  C=foobar GetRequest(29)  .1.3.6.1.2.1.25.1.4.0
08:25:55.113360 IP 10.10.9.36.59520 > 1.2.3.4.161:  C=foobar GetRequest(29)  .1.3.6.1.2.1.25.1.4.0
08:25:56.114809 IP 10.10.9.36.59520 > 1.2.3.4.161:  C=foobar GetRequest(29)  .1.3.6.1.2.1.25.1.4.0
08:25:57.115923 IP 10.10.9.36.59520 > 1.2.3.4.161:  C=foobar GetRequest(29)  .1.3.6.1.2.1.25.1.4.0
08:25:58.291393 IP 10.10.9.36.60047 > 1.2.3.4.161:  C=foobar GetRequest(28)  .1.3.6.1.2.1.25.1.4.0
08:25:59.292572 IP 10.10.9.36.60047 > 1.2.3.4.161:  C=foobar GetRequest(28)  .1.3.6.1.2.1.25.1.4.0
08:26:00.293341 IP 10.10.9.36.60047 > 1.2.3.4.161:  C=foobar GetRequest(28)  .1.3.6.1.2.1.25.1.4.0
08:26:01.294729 IP 10.10.9.36.60047 > 1.2.3.4.161:  C=foobar GetRequest(28)  .1.3.6.1.2.1.25.1.4.0
08:26:02.296123 IP 10.10.9.36.60047 > 1.2.3.4.161:  C=foobar GetRequest(28)  .1.3.6.1.2.1.25.1.4.0
08:26:03.297236 IP 10.10.9.36.60047 > 1.2.3.4.161:  C=foobar GetRequest(28)  .1.3.6.1.2.1.25.1.4.0
08:26:04.394151 IP 10.10.9.36.58769 > 1.2.3.4.161:  C=foobar GetBulk(36)  N=0 M=10 .1.3.6.1.4.1.674.10893.1.20.140.1.1.3
08:26:05.395225 IP 10.10.9.36.58769 > 1.2.3.4.161:  C=foobar GetBulk(36)  N=0 M=10 .1.3.6.1.4.1.674.10893.1.20.140.1.1.3
08:26:06.396641 IP 10.10.9.36.58769 > 1.2.3.4.161:  C=foobar GetBulk(36)  N=0 M=10 .1.3.6.1.4.1.674.10893.1.20.140.1.1.3
08:26:07.397351 IP 10.10.9.36.58769 > 1.2.3.4.161:  C=foobar GetBulk(36)  N=0 M=10 .1.3.6.1.4.1.674.10893.1.20.140.1.1.3
08:26:08.398779 IP 10.10.9.36.58769 > 1.2.3.4.161:  C=foobar GetBulk(36)  N=0 M=10 .1.3.6.1.4.1.674.10893.1.20.140.1.1.3
08:26:09.400204 IP 10.10.9.36.58769 > 1.2.3.4.161:  C=foobar GetBulk(36)  N=0 M=10 .1.3.6.1.4.1.674.10893.1.20.140.1.1.3
08:26:10.534108 IP 10.10.9.36.41096 > 1.2.3.4.161:  C=foobar GetBulk(29)  N=0 M=10 .1.3.6.1.2.1.25.2.3.1
08:26:11.535580 IP 10.10.9.36.41096 > 1.2.3.4.161:  C=foobar GetBulk(29)  N=0 M=10 .1.3.6.1.2.1.25.2.3.1
08:26:12.537010 IP 10.10.9.36.41096 > 1.2.3.4.161:  C=foobar GetBulk(29)  N=0 M=10 .1.3.6.1.2.1.25.2.3.1
08:26:13.537810 IP 10.10.9.36.41096 > 1.2.3.4.161:  C=foobar GetBulk(29)  N=0 M=10 .1.3.6.1.2.1.25.2.3.1
08:26:14.541501 IP 10.10.9.36.41096 > 1.2.3.4.161:  C=foobar GetBulk(29)  N=0 M=10 .1.3.6.1.2.1.25.2.3.1
08:26:15.542804 IP 10.10.9.36.41096 > 1.2.3.4.161:  C=foobar GetBulk(29)  N=0 M=10 .1.3.6.1.2.1.25.2.3.1
08:26:16.812425 IP 10.10.9.36.43626 > 1.2.3.4.161:  C=foobar GetBulk(32)  N=0 M=10 .1.3.6.1.4.1.12740.5.1.7.1.1
08:26:17.813368 IP 10.10.9.36.43626 > 1.2.3.4.161:  C=foobar GetBulk(32)  N=0 M=10 .1.3.6.1.4.1.12740.5.1.7.1.1
08:26:18.814728 IP 10.10.9.36.43626 > 1.2.3.4.161:  C=foobar GetBulk(32)  N=0 M=10 .1.3.6.1.4.1.12740.5.1.7.1.1
08:26:19.820808 IP 10.10.9.36.43626 > 1.2.3.4.161:  C=foobar GetBulk(32)  N=0 M=10 .1.3.6.1.4.1.12740.5.1.7.1.1
08:26:20.822218 IP 10.10.9.36.43626 > 1.2.3.4.161:  C=foobar GetBulk(32)  N=0 M=10 .1.3.6.1.4.1.12740.5.1.7.1.1
08:26:21.823973 IP 10.10.9.36.43626 > 1.2.3.4.161:  C=foobar GetBulk(32)  N=0 M=10 .1.3.6.1.4.1.12740.5.1.7.1.1
08:26:23.009522 IP 10.10.9.36.36733 > 1.2.3.4.161:  C=foobar GetBulk(31)  N=0 M=10 .1.3.6.1.4.1.789.1.5.4.1
08:26:24.010605 IP 10.10.9.36.36733 > 1.2.3.4.161:  C=foobar GetBulk(31)  N=0 M=10 .1.3.6.1.4.1.789.1.5.4.1
08:26:25.011844 IP 10.10.9.36.36733 > 1.2.3.4.161:  C=foobar GetBulk(31)  N=0 M=10 .1.3.6.1.4.1.789.1.5.4.1
08:26:26.013983 IP 10.10.9.36.36733 > 1.2.3.4.161:  C=foobar GetBulk(31)  N=0 M=10 .1.3.6.1.4.1.789.1.5.4.1
08:26:27.016651 IP 10.10.9.36.36733 > 1.2.3.4.161:  C=foobar GetBulk(31)  N=0 M=10 .1.3.6.1.4.1.789.1.5.4.1
08:26:28.029376 IP 10.10.9.36.36733 > 1.2.3.4.161:  C=foobar GetBulk(31)  N=0 M=10 .1.3.6.1.4.1.789.1.5.4.1
08:26:29.277580 IP 10.10.9.36.51151 > 1.2.3.4.161:  C=foobar GetBulk(29)  N=0 M=10 .1.3.6.1.2.1.25.3.2.1
08:26:30.279146 IP 10.10.9.36.51151 > 1.2.3.4.161:  C=foobar GetBulk(29)  N=0 M=10 .1.3.6.1.2.1.25.3.2.1
08:26:31.280198 IP 10.10.9.36.51151 > 1.2.3.4.161:  C=foobar GetBulk(29)  N=0 M=10 .1.3.6.1.2.1.25.3.2.1
08:26:32.280722 IP 10.10.9.36.51151 > 1.2.3.4.161:  C=foobar GetBulk(29)  N=0 M=10 .1.3.6.1.2.1.25.3.2.1
08:26:33.281339 IP 10.10.9.36.51151 > 1.2.3.4.161:  C=foobar GetBulk(29)  N=0 M=10 .1.3.6.1.2.1.25.3.2.1
08:26:34.281959 IP 10.10.9.36.51151 > 1.2.3.4.161:  C=foobar GetBulk(29)  N=0 M=10 .1.3.6.1.2.1.25.3.2.1
08:26:35.363706 IP 10.10.9.36.46744 > 1.2.3.4.161:  C=foobar GetBulk(29)  N=0 M=10 .1.3.6.1.2.1.25.3.3.1
08:26:36.365346 IP 10.10.9.36.46744 > 1.2.3.4.161:  C=foobar GetBulk(29)  N=0 M=10 .1.3.6.1.2.1.25.3.3.1
08:26:37.366465 IP 10.10.9.36.46744 > 1.2.3.4.161:  C=foobar GetBulk(29)  N=0 M=10 .1.3.6.1.2.1.25.3.3.1
08:26:38.367841 IP 10.10.9.36.46744 > 1.2.3.4.161:  C=foobar GetBulk(29)  N=0 M=10 .1.3.6.1.2.1.25.3.3.1
08:26:39.369227 IP 10.10.9.36.46744 > 1.2.3.4.161:  C=foobar GetBulk(29)  N=0 M=10 .1.3.6.1.2.1.25.3.3.1
08:26:40.370632 IP 10.10.9.36.46744 > 1.2.3.4.161:  C=foobar GetBulk(29)  N=0 M=10 .1.3.6.1.2.1.25.3.3.1
08:26:41.487141 IP 10.10.9.36.54490 > 1.2.3.4.161:  C=foobar GetBulk(30)  N=0 M=10 .1.3.6.1.4.1.9.9.23.1.2
08:26:42.493143 IP 10.10.9.36.54490 > 1.2.3.4.161:  C=foobar GetBulk(30)  N=0 M=10 .1.3.6.1.4.1.9.9.23.1.2
08:26:43.495539 IP 10.10.9.36.54490 > 1.2.3.4.161:  C=foobar GetBulk(30)  N=0 M=10 .1.3.6.1.4.1.9.9.23.1.2
08:26:44.496956 IP 10.10.9.36.54490 > 1.2.3.4.161:  C=foobar GetBulk(30)  N=0 M=10 .1.3.6.1.4.1.9.9.23.1.2
08:26:45.499142 IP 10.10.9.36.54490 > 1.2.3.4.161:  C=foobar GetBulk(30)  N=0 M=10 .1.3.6.1.4.1.9.9.23.1.2
08:26:46.500549 IP 10.10.9.36.54490 > 1.2.3.4.161:  C=foobar GetBulk(30)  N=0 M=10 .1.3.6.1.4.1.9.9.23.1.2
08:26:47.690997 IP 10.10.9.36.55135 > 1.2.3.4.161:  C=foobar GetBulk(28)  N=0 M=10 .1.0.8802.1.1.2.1.4
08:26:48.691995 IP 10.10.9.36.55135 > 1.2.3.4.161:  C=foobar GetBulk(28)  N=0 M=10 .1.0.8802.1.1.2.1.4
08:26:49.700325 IP 10.10.9.36.55135 > 1.2.3.4.161:  C=foobar GetBulk(28)  N=0 M=10 .1.0.8802.1.1.2.1.4
08:26:50.701395 IP 10.10.9.36.55135 > 1.2.3.4.161:  C=foobar GetBulk(28)  N=0 M=10 .1.0.8802.1.1.2.1.4
08:26:51.702494 IP 10.10.9.36.55135 > 1.2.3.4.161:  C=foobar GetBulk(28)  N=0 M=10 .1.0.8802.1.1.2.1.4
08:26:52.715262 IP 10.10.9.36.55135 > 1.2.3.4.161:  C=foobar GetBulk(28)  N=0 M=10 .1.0.8802.1.1.2.1.4
08:26:53.824652 IP 10.10.9.36.58186 > 1.2.3.4.161:  C=foobar GetBulk(30)  N=0 M=10 .1.3.6.1.2.1.17.1.4.1.2
08:26:54.825423 IP 10.10.9.36.58186 > 1.2.3.4.161:  C=foobar GetBulk(30)  N=0 M=10 .1.3.6.1.2.1.17.1.4.1.2
08:26:55.826556 IP 10.10.9.36.58186 > 1.2.3.4.161:  C=foobar GetBulk(30)  N=0 M=10 .1.3.6.1.2.1.17.1.4.1.2
08:26:56.826839 IP 10.10.9.36.58186 > 1.2.3.4.161:  C=foobar GetBulk(30)  N=0 M=10 .1.3.6.1.2.1.17.1.4.1.2
08:26:57.828275 IP 10.10.9.36.58186 > 1.2.3.4.161:  C=foobar GetBulk(30)  N=0 M=10 .1.3.6.1.2.1.17.1.4.1.2
08:26:58.829333 IP 10.10.9.36.58186 > 1.2.3.4.161:  C=foobar GetBulk(30)  N=0 M=10 .1.3.6.1.2.1.17.1.4.1.2
08:26:59.970639 IP 10.10.9.36.54161 > 1.2.3.4.161:  C=foobar GetBulk(29)  N=0 M=10 .1.3.6.1.2.1.4.35.1.4
08:27:00.971306 IP 10.10.9.36.54161 > 1.2.3.4.161:  C=foobar GetBulk(29)  N=0 M=10 .1.3.6.1.2.1.4.35.1.4
08:27:01.972578 IP 10.10.9.36.54161 > 1.2.3.4.161:  C=foobar GetBulk(29)  N=0 M=10 .1.3.6.1.2.1.4.35.1.4
08:27:02.973698 IP 10.10.9.36.54161 > 1.2.3.4.161:  C=foobar GetBulk(29)  N=0 M=10 .1.3.6.1.2.1.4.35.1.4
08:27:03.974495 IP 10.10.9.36.54161 > 1.2.3.4.161:  C=foobar GetBulk(29)  N=0 M=10 .1.3.6.1.2.1.4.35.1.4
08:27:04.975762 IP 10.10.9.36.54161 > 1.2.3.4.161:  C=foobar GetBulk(29)  N=0 M=10 .1.3.6.1.2.1.4.35.1.4
08:27:06.110631 IP 10.10.9.36.47958 > 1.2.3.4.161:  C=foobar GetBulk(27)  N=0 M=10 .1.3.6.1.2.1.15.2
08:27:07.112025 IP 10.10.9.36.47958 > 1.2.3.4.161:  C=foobar GetBulk(27)  N=0 M=10 .1.3.6.1.2.1.15.2
08:27:08.113381 IP 10.10.9.36.47958 > 1.2.3.4.161:  C=foobar GetBulk(27)  N=0 M=10 .1.3.6.1.2.1.15.2
08:27:09.114994 IP 10.10.9.36.47958 > 1.2.3.4.161:  C=foobar GetBulk(27)  N=0 M=10 .1.3.6.1.2.1.15.2
08:27:10.116603 IP 10.10.9.36.47958 > 1.2.3.4.161:  C=foobar GetBulk(27)  N=0 M=10 .1.3.6.1.2.1.15.2
08:27:11.117436 IP 10.10.9.36.47958 > 1.2.3.4.161:  C=foobar GetBulk(27)  N=0 M=10 .1.3.6.1.2.1.15.2
08:27:12.325449 IP 10.10.9.36.52307 > 1.2.3.4.161:  C=foobar GetRequest(31)  .1.3.6.1.2.1.17.7.1.1.1.0
08:27:13.326133 IP 10.10.9.36.52307 > 1.2.3.4.161:  C=foobar GetRequest(31)  .1.3.6.1.2.1.17.7.1.1.1.0
08:27:14.327620 IP 10.10.9.36.52307 > 1.2.3.4.161:  C=foobar GetRequest(31)  .1.3.6.1.2.1.17.7.1.1.1.0
08:27:15.328715 IP 10.10.9.36.52307 > 1.2.3.4.161:  C=foobar GetRequest(31)  .1.3.6.1.2.1.17.7.1.1.1.0
08:27:16.329651 IP 10.10.9.36.52307 > 1.2.3.4.161:  C=foobar GetRequest(31)  .1.3.6.1.2.1.17.7.1.1.1.0
08:27:17.331753 IP 10.10.9.36.52307 > 1.2.3.4.161:  C=foobar GetRequest(31)  .1.3.6.1.2.1.17.7.1.1.1.0
08:27:18.594885 IP 10.10.9.36.60349 > 1.2.3.4.161:  C=foobar GetBulk(31)  N=0 M=10 .1.3.6.1.4.1.2021.13.15.1.1
08:27:19.595259 IP 10.10.9.36.60349 > 1.2.3.4.161:  C=foobar GetBulk(31)  N=0 M=10 .1.3.6.1.4.1.2021.13.15.1.1
08:27:20.596401 IP 10.10.9.36.60349 > 1.2.3.4.161:  C=foobar GetBulk(31)  N=0 M=10 .1.3.6.1.4.1.2021.13.15.1.1
08:27:21.597369 IP 10.10.9.36.60349 > 1.2.3.4.161:  C=foobar GetBulk(31)  N=0 M=10 .1.3.6.1.4.1.2021.13.15.1.1
08:27:22.598769 IP 10.10.9.36.60349 > 1.2.3.4.161:  C=foobar GetBulk(31)  N=0 M=10 .1.3.6.1.4.1.2021.13.15.1.1
08:27:23.600176 IP 10.10.9.36.60349 > 1.2.3.4.161:  C=foobar GetBulk(31)  N=0 M=10 .1.3.6.1.4.1.2021.13.15.1.1
08:27:24.733880 IP 10.10.9.36.45324 > 1.2.3.4.161:  C=foobar GetRequest(29)  .1.3.6.1.2.1.17.2.1.0
08:27:25.735718 IP 10.10.9.36.45324 > 1.2.3.4.161:  C=foobar GetRequest(29)  .1.3.6.1.2.1.17.2.1.0
08:27:26.737342 IP 10.10.9.36.45324 > 1.2.3.4.161:  C=foobar GetRequest(29)  .1.3.6.1.2.1.17.2.1.0
08:27:27.738798 IP 10.10.9.36.45324 > 1.2.3.4.161:  C=foobar GetRequest(29)  .1.3.6.1.2.1.17.2.1.0
08:27:28.739911 IP 10.10.9.36.45324 > 1.2.3.4.161:  C=foobar GetRequest(29)  .1.3.6.1.2.1.17.2.1.0
08:27:29.741318 IP 10.10.9.36.45324 > 1.2.3.4.161:  C=foobar GetRequest(29)  .1.3.6.1.2.1.17.2.1.0
~~~

It seems to me that a simple solution would be to perform the first SNMP query and bail out the whole process if no answer is received. The first two queries performed are .1.3.6.1.2.1.1.1.0 (sysDescr.0) and .1.3.6.1.2.1.1.2.0 (sysObjectID.0), both of which should be fine for this purpose, as any SNMP-compliant device will answer those.

**Comment by laf** [comment]
We already do that and again this is the behavior that I see:

```bash
-bash-4.2$ time ./discovery.php -h 1.2.3.4
LibreNMS Discovery
Version info:
Commit SHA: ed48e8f0c88ca75a53ad99a60cea0d33d7054a79
DB Schema: 133
PHP: 7.0.9
MySQL: 5.5.47-MariaDB
RRDTool: 1.6.0
SNMP: NET-SNMP version: 5.7.2

MySQL: Cell[1/0s] Row[3/0s] Rows[1/0s] Column[0/0s] Update[0/0s] Insert[0/0s] Delete[0/0s]

real    0m0.129s
user    0m0.088s
sys     0m0.035s

```

Do you have some settings in /etc/snmp/snmp.conf or have you changed the snmp timeout from the default value?

**Comment by laf** [comment]
You could also run `./discovery.php -h 1.2.3.4 -d -m os` and pastebin the output

**Comment by candlerb** [comment]
(BTW, platform is Ubuntu 16.04, running inside lxd container)

~~~
# cat /etc/snmp/snmp.conf
#mibs :

defVersion 3
defSecurityLevel authNoPriv
defSecurityName admin
defAuthPassphrase NetManage
defAuthType SHA

# Default community when using SNMP v2c
defCommunity NetManage
~~~

> You could also run ./discovery.php -h 1.2.3.4 -d -m os and pastebin the output

It just shows the various SNMP queries being done and each one timing out. Short enough to paste inline:

~~~
$ ./discovery.php -h 1.2.3.4 -d -m os
LibreNMS Discovery
Version info:
Commit SHA: 361732bfc203c8476c8baf4e6663963b53099cf6
DB Schema: 118
PHP: 7.0.8-0ubuntu0.16.04.2
MySQL: 5.7.15-0ubuntu0.16.04.1
RRDTool: 1.5.5
SNMP: NET-SNMP version: 5.7.3

DEBUG!

SQL[SELECT version FROM `dbSchema` ORDER BY version DESC LIMIT 1]
SQL[SELECT revision FROM `dbSchema`] DB Schema already up to date.

SQL[SELECT * FROM `devices` WHERE status = 1 AND disabled = 0 AND `hostname` LIKE '1.2.3.4' ORDER BY device_id DESC]
SQL[SELECT * FROM devices_attribs WHERE `device_id` = '1'] 1.2.3.4 1 generic /usr/bin/snmpget -v2c -c COMMUNITY -Ovq -M /opt/librenms/mibs udp:HOSTNAME:161 SNMPv2-MIB::sysDescr.0Timeout: No Response from udp:1.2.3.4:161.

/usr/bin/snmpget -v2c -c COMMUNITY -Ovqn -M /opt/librenms/mibs udp:HOSTNAME:161 SNMPv2-MIB::sysObjectID.0Timeout: No Response from udp:1.2.3.4:161.

|  |  |
/usr/bin/snmpget -v2c -c COMMUNITY -Oqvn -M /opt/librenms/mibs udp:HOSTNAME:161 ENTITY-MIB::entPhysicalDescr.1Timeout: No Response from udp:1.2.3.4:161.

/usr/bin/snmpget -v2c -c COMMUNITY -Oqv -M /opt/librenms/mibs udp:HOSTNAME:161 GAMATRONIC-MIB::psUnitManufacture.0Timeout: No Response from udp:1.2.3.4:161.

/usr/bin/snmpget -v2c -c COMMUNITY -Oqv -M /opt/librenms/mibs udp:HOSTNAME:161 .1.3.6.1.4.1.39165.1.6.0Timeout: No Response from udp:1.2.3.4:161.

/usr/bin/snmpget -v2c -c COMMUNITY -Oqv -M /opt/librenms/mibs udp:HOSTNAME:161 SML-MIB::product-Name.0Timeout: No Response from udp:1.2.3.4:161.

/usr/bin/snmpget -v2c -c COMMUNITY -Oqv -M /opt/librenms/mibs udp:HOSTNAME:161 1.3.6.1.4.1.674.10895.3000.1.2.100.1.0Timeout: No Response from udp:1.2.3.4:161.

/usr/bin/snmpget -v2c -c COMMUNITY -Osqnv -M /opt/librenms/mibs udp:HOSTNAME:161 ENTITY-MIB::entPhysicalMfgName.1Timeout: No Response from udp:1.2.3.4:161.

/usr/bin/snmpget -v2c -c COMMUNITY -Oqv -M /opt/librenms/mibs udp:HOSTNAME:161 SNMPv2-MIB::sysName.0Timeout: No Response from udp:1.2.3.4:161.


#### Load disco module os ####
/usr/bin/snmpget -v2c -c COMMUNITY -Ovq -M /opt/librenms/mibs udp:HOSTNAME:161 SNMPv2-MIB::sysDescr.0Timeout: No Response from udp:1.2.3.4:161.

/usr/bin/snmpget -v2c -c COMMUNITY -Ovqn -M /opt/librenms/mibs udp:HOSTNAME:161 SNMPv2-MIB::sysObjectID.0Timeout: No Response from udp:1.2.3.4:161.

|  |  |
/usr/bin/snmpget -v2c -c COMMUNITY -Oqvn -M /opt/librenms/mibs udp:HOSTNAME:161 ENTITY-MIB::entPhysicalDescr.1Timeout: No Response from udp:1.2.3.4:161.

/usr/bin/snmpget -v2c -c COMMUNITY -Oqv -M /opt/librenms/mibs udp:HOSTNAME:161 GAMATRONIC-MIB::psUnitManufacture.0Timeout: No Response from udp:1.2.3.4:161.

/usr/bin/snmpget -v2c -c COMMUNITY -Oqv -M /opt/librenms/mibs udp:HOSTNAME:161 .1.3.6.1.4.1.39165.1.6.0Timeout: No Response from udp:1.2.3.4:161.

/usr/bin/snmpget -v2c -c COMMUNITY -Oqv -M /opt/librenms/mibs udp:HOSTNAME:161 SML-MIB::product-Name.0Timeout: No Response from udp:1.2.3.4:161.

/usr/bin/snmpget -v2c -c COMMUNITY -Oqv -M /opt/librenms/mibs udp:HOSTNAME:161 1.3.6.1.4.1.674.10895.3000.1.2.100.1.0Timeout: No Response from udp:1.2.3.4:161.

/usr/bin/snmpget -v2c -c COMMUNITY -Osqnv -M /opt/librenms/mibs udp:HOSTNAME:161 ENTITY-MIB::entPhysicalMfgName.1Timeout: No Response from udp:1.2.3.4:161.

/usr/bin/snmpget -v2c -c COMMUNITY -Oqv -M /opt/librenms/mibs udp:HOSTNAME:161 SNMPv2-MIB::sysName.0Timeout: No Response from udp:1.2.3.4:161.


>> Runtime for discovery module 'os': 54.83 seconds
#### Unload disco module os ####


SQL[SELECT attrib_value FROM devices_attribs WHERE `device_id` = '1' AND `attrib_type` = 'poll_mib' ]
SQL[UPDATE `devices` set `last_discovered` =NOW(),`type` ='',`last_discovered_timetaken` ='110.0' WHERE `device_id` = '1'] Discovered in 110.0 seconds


SQL[INSERT INTO `perf_times` (`type`,`doing`,`start`,`duration`,`devices`)  VALUES ('discover','1.2.3.4','1474015966.084','110.2','1')] ./discovery.php 1.2.3.4 2016-09-16 08:54:36 - 1 devices discovered in 110.2 secs
MySQL: Cell[1/0s] Row[4/0s] Rows[1/0s] Column[0/0s] Update[1/0s] Insert[1/0s] Delete[0/0s]
~~~

If I try one of those queries manually:

~~~
$ time /usr/bin/snmpget -v2c -c foobar -Ovq -M /opt/librenms/mibs udp:1.2.3.4:161 SNMPv2-MIB::sysDescr.0
Timeout: No Response from udp:1.2.3.4:161.

real	0m6.146s
user	0m0.056s
sys	0m0.008s
$ echo $?
1
~~~

**Comment by laf** [comment]
Are you running poller as that will mark the device as status = 0 so it won't be discovered - what does the status of the device show in the webui?

**Comment by candlerb** [comment]
What I'm actually try to do is a scripted setup - actually building a VM. As part of this I:

- install a blank librenms
- run `addhost.php -f` for a bunch of devices (some of which may not be online right now)
- run `discovery.php -h all`
- *then* install the crontab so that librenms starts its periodic polling

I was basing it on [these installation instructions](http://librenms.readthedocs.io/Installation/Installation-(Debian-Ubuntu)/) which say to run `addhost.php localhost`, then `discovery.php -h all`, then install the crontab.

Aside: I did see that there are [other installation instructions](http://docs.librenms.org/Installation/Installation-Ubuntu-1604-Apache/) which don't mention addhost.php, but I am trying to automate the setup.

**Comment by laf** [comment]
The first docs you linked to are old, not sure how you got to them but everything in docs.librenms.org is current but yes the new docs tell you to add the device using the webui.

Just don't run discovery.php, I'm unsure why you would need to do that when you've added a device that is offline and won't respond to anything. You should just:

Setup the install _IN FULL_ including cron.

Add your devices.

And do nothing else until the devices are brought online, after that, do nothing still.

**Comment by candlerb** [comment]
Sure I can do that, although it means for any devices which are up, they won't get discovered until the next cron-based discovery.

I was also wondering about the following scenario:

* Device is up. Added and discovered just fine.
* Device goes offline for a while
* The periodic rediscovery runs from cron:

    ~~~
    33  */6   * * *   librenms    /opt/librenms/discovery.php -h all >> /dev/null 2>&1
    ~~~

Isn't that going to sit around doing lots of wasted queries? But from what you said above, if the *poller* has first tried to talk to the device and failed, it will mark the device as down and the discovery process will ignore it.

I can test that easily enough:

~~~
$ time ./poller-wrapper.py 4
INFO: starting the poller at 2016-09-16 09:20:47 with 4 threads, slowest devices first
INFO: worker Thread-1 finished device 1 in 2 seconds
INFO: worker Thread-2 finished device 2 in 2 seconds
INFO: worker Thread-3 finished device 3 in 2 seconds
INFO: poller-wrapper polled 3 devices in 2 seconds with 4 workers

real	0m2.504s
user	0m0.540s
sys	0m0.092s
$ time ./discovery.php -h all
LibreNMS Discovery
Version info:
Commit SHA: baca34d8d3b0df0e96efcc5a42c766c9b49dfcc3
DB Schema: 118
PHP: 7.0.8-0ubuntu0.16.04.2
MySQL: 5.7.15-0ubuntu0.16.04.1
RRDTool: 1.5.5
SNMP: NET-SNMP version: 5.7.3

MySQL: Cell[1/0s] Row[3/0s] Rows[1/0s] Column[0/0s] Update[0/0s] Insert[0/0s] Delete[0/0s]

real	0m0.717s
user	0m0.216s
sys	0m0.016s
~~~

(tcpdump shows it trying to ping the devices). OK that looks good. It seems the answer for me would be to run the poller *before* running discovery, I'll try that in the scripts.

**Comment by laf** [comment]
They will get discovered as cron will be running, but devices marked as down won't because they are down.

No discovery will not sit there, poller will have marked the device down before discovery runs.

Please just don't run poller or discovery manually, it is absolutely not needed at all unless you want to debug.

Setup cron
Add devices

That's it, you don't need to do anything else.

**Comment by candlerb** [comment]
OK. What I was trying to avoid was an (up to) 6 hour delay between starting the VM and devices changing category from "generic" to "server", "network" etc.

However I can see there is "discovery -h new" run every 5 minutes. I'll check that works.

**Comment by laf** [comment]
The 5 min cron for discovery -h new only picks up newly added devices. I'm not sure a device that's just been offline for a while be classed as that.

You can reset last_discovered in the devices table for that device back to NULL and that will force it to be rediscovered as a new device or just kick off \./discovery.php -h <DEVICE>\

**Comment by candlerb** [comment]
`-h new` checks for `last_discovered = NULL` and will also skip devices which don't have `status = 1`. So I would imagine they would stay in that state until they come online, but I can test this.

**Comment by candlerb** [comment]
It seems that new devices are added with status=1, and only go to status=0 after the poller runs and fails to talk to them.

Maybe it would be safer to create with status=0? At least when using the `-f` flag if not always? (Since the `-f` flag now implies no attempt to communicate has been made)

**Comment by laf** [comment]
I'll be honest and say I doubt we will change that, your use case is totally different and would mean new devices would need to be polled once before being discovered where as now both polling and discovery will run together or most likely discovery first which is the intended behavior

**Comment by candlerb** [comment]
Full disclosure: the use case is for training workshops. There is a central server configured with librenms and other tools like nagios, pointing at all the student infrastructure such as routers and servers.

As the class proceeds, students configure their devices and install various software. (In the case of a network monitoring and management workshop, they will of course be installing their own instances of librenms as well!)

As they enable snmp with the correct credentials, we want things to start appearing in the central monitoring server. The central nagios starts turning green; the central librenms starts drawing graphs etc. This gives the instructor an overview of progress, and also the students see an example of a "real" monitoring system in action.

So the ideal scenario would be that once a device comes up, librenms would discover (*) it and configure itself. Using `addhost.php -f` to pre-fill all the equipment, it all comes up as "Generic Device", which is fine, but it would be better to show the actual device type. However it's not the end of the world if it takes 6 hours; everything will be correct the next day. Or else, the instructor can kick off discovery by hand. It's just a nice-to-have.

(*) ISTM that in librenms, "discovery" does two separate functions:

1. It gathers information about the device, such as what type of device it is, what interfaces it has etc.
2. It adds new devices which may be learned about as neighbours of that device

In the first case it's "discovering" information about the device which has already been added. In the second case it's "discovering" new devices on the network. Is that correct?

**Comment by laf** [comment]
1. correct - based on the discovery modules.

2. correct
