### ISSUE TITLE
LLDPv2 with snmpd proxy - high cpu usage

### ISSUE THREAD

**Issue by maxilee** [librenms/librenms#16294]
### The problem

hi.
I've observed high cpu usage on our hosts which are running snmpd proxy for libreNSM.
I'm not sure when the problem start occur - in which version of librenms - but IMHO that problem is related to pull request : 
https://github.com/librenms/librenms/pull/16113 

we have got simple setup for libreNSM: 
libreNMS host -> linux host with SNMP proxy ( net-snmp ) -> monitored machine/router/switch etc

on linux host with snmpd proxy we have got config for net-snmp : 
```
access  notConfigGroup end_point_name        any     noauth  prefix  systemview none none
com2sec -Cn end_point_name notConfigUser default end_point_name
proxy -Cn end_point_name -v 2c -c _community_ 1.2.3.4 .1.3

```
where end_point_name - is the name of monitored device 
_community_ - this is community of monitored device 
1.2.3.4 - this is IP of monitored device

on libreNMS we have got entries in /etc/hosts 
`4.3.2.1 end_point_name `

so on librenms we can do snmpwalk 
snmpwalk -v2c -c end_point_name end_point_name 

and so far this setup was working fine.
currently when librenms start asking SNMPD about LLDPv2 OID : .1.3.111.2.802.1.1.13.1.4.1 , 
snmpd proxy process on linux host start loops causing high CPU usage.

I can recreate high cpu usage on snmpd proxy just using snmpwalk command : 
`snmpwalk -v2c -c end_point_name end_point_name .1.3.111.2.802.1.1.13.1.4.1` 
and this work all the time causing loop inside snmpd proxy.

currently I've disable pooling LLDPv2 in libreNSM by disable line in discovery-protocols.inc.php:
line 282:
`$lldpv2_array = SnmpQuery::hideMib()->walk('LLDP-V2-MIB::lldpV2RemTable')->table(4);`

and now problem with high cpu usage doesn't appear.

I'm not sure where the real problem is - on snmpd proxy ? or in monitored end point device. as end point devices we are monitoring many different devices: linux hosts, switches , routers , windows hosts and problem appears on all of them.

### Output of ./validate.php

```txt
[librenms@libre ~]$ ./validate.php 
===========================================
Component | Version
--------- | -------
LibreNMS  | 24.8.0 (2024-08-15T22:14:10+02:00)
DB Schema | 2024_07_19_120719_update_ports_stack_table (296)
PHP       | 8.1.11
Python    | 3.6.8
Database  | MariaDB 10.3.35-MariaDB
RRDTool   | 1.7.0
SNMP      | 5.8
===========================================

[OK]    Composer Version: 2.7.7
[OK]    Dependencies up-to-date.
[OK]    Database connection successful
[OK]    Database connection successful
[OK]    Database Schema is current
[OK]    SQL Server meets minimum requirements
[OK]    lower_case_table_names is enabled
[OK]    MySQL engine is optimal
[OK]    Database and column collations are correct
[OK]    Database schema correct
[OK]    MySQL and PHP time match
[OK]    Active pollers found
[OK]    Dispatcher Service not detected
[OK]    Locks are functional
[OK]    Python poller wrapper is polling
[OK]    Redis is unavailable
[OK]    rrdtool version ok
[OK]    Connected to rrdcached
[FAIL]  Scheduler is not running
        [FIX]: 
        sudo cp /opt/librenms/dist/librenms-scheduler.service /opt/librenms/dist/librenms-scheduler.timer /etc/systemd/system/
        sudo systemctl enable librenms-scheduler.timer
        sudo systemctl start librenms-scheduler.timer
[WARN]  Your local git contains modified files, this could prevent automatic updates.
        [FIX]: 
        You can fix this with ./scripts/github-remove
        Modified Files:
         includes/discovery/discovery-protocols.inc.php
[FAIL]  We have found some files that are owned by a different user than 'librenms', this will stop you updating automatically and / or rrd files being updated causing graphs to fail.
        [FIX]: 
        sudo chown -R librenms:librenms /opt/librenms
        sudo setfacl -d -m g::rwx /opt/librenms/rrd /opt/librenms/logs /opt/librenms/bootstrap/cache/ /opt/librenms/storage/
        sudo chmod -R ug=rwX /opt/librenms/rrd /opt/librenms/logs /opt/librenms/bootstrap/cache/ /opt/librenms/storage/
        Files:
         /opt/librenms/includes/discovery/discovery-protocols.inc.php-ORG
```

**Comment by PipoCanaja** [comment]
Hi @maxilee 
Please check if the issue can be reproduced without the proxy. I suspect that the proxy (which does not have the mib loaded most probably) may loop on non increasing OIDs. 
Would also be very interesting to see on which OIDs exactly it shows this behaviour (to se if we can poll in a different way).

**Comment by maxilee** [comment]
Hi @PipoCanaja 

when I do query direct to end point - without proxy I've got reply : 
```
[root@librenms ~]# snmpwalk -v2c -c public 1.2.3.4 .1.3.111.2.802.1.1.13.1.4.1
SNMPv2-SMI::org.111.2.802.1.1.13.1.4.1 = No more variables left in this MIB View (It is past the end of the MIB tree)
```
I've made another test - on proxy machine I've downloaded mibs LLDP-V2-MIB and all other modules which it depends 
and snmp tools are use them 
```
[root@proxy ~]# snmptranslate .1.3.111.2.802.1.1.13.1.4.1 -mALL
LLDP-V2-MIB::lldpV2RemTable
```
so I've started snmpd manualy :
```
/usr/sbin/snmpd -f -Lo: -Dparse-mibs -mALL
```
mib modules LLDP-V2-MIB is loaded and parsed by deamon 
```
parse-mibs: Processing IMPORTS for module 32 LLDP-V2-MIB                                                                                                                                    parse-mibs:   Processing import: TimeStamp                                                                                                                                                  parse-mibs:   Processing import: TruthValue                                                                                                                                                 parse-mibs:   Processing import: MacAddress                                                                                                                                                 parse-mibs:   Processing import: RowStatus                                                                                                                                                  parse-mibs:   Processing import: SnmpAdminString                                                                                                                                            parse-mibs:   Processing import: TimeFilter                                                                                                                                                 parse-mibs:   Processing import: ZeroBasedCounter32
parse-mibs:   Processing import: AddressFamilyNumbers
parse-mibs:   Processing import: ifGeneralInformationGroup
parse-mibs:   Processing import: InterfaceIndex
parse-mibs:   Processing import: LldpV2ChassisIdSubtype
parse-mibs:   Processing import: LldpV2ChassisId
parse-mibs:   Processing import: LldpV2PortIdSubtype
parse-mibs:   Processing import: LldpV2PortId
parse-mibs:   Processing import: LldpV2ManAddrIfSubtype
parse-mibs:   Processing import: LldpV2ManAddress
parse-mibs:   Processing import: LldpV2SystemCapabilitiesMap
parse-mibs:   Processing import: LldpV2DestAddressTableIndex
parse-mibs:   Processing import: ieee802dot1mibs
```

and the I've made query via proxy - situation is the same - loop on snmpd and high cpu usage.

I've dumped network traffic between proxy and endpoint 1.2.3.4:
```
09:49:41.247975 IP 1.2.3.4.snmp > proxy.56459:  GetResponse(31)  .1.3.111.2.802.1.1.13.1.4.1=[endOfMibView]
09:49:41.248402 IP 1.2.3.4.snmp > proxy.56459:  GetResponse(31)  .1.3.111.2.802.1.1.13.1.4.1=[endOfMibView]
09:49:41.248482 IP proxy.56459 > 1.2.3.4.snmp:  GetNextRequest(31)  .1.3.111.2.802.1.1.13.1.4.1
09:49:41.248684 IP proxy.56459 > 1.2.3.4.snmp:  GetNextRequest(31)  .1.3.111.2.802.1.1.13.1.4.1
09:49:41.249470 IP 1.2.3.4.snmp > proxy.56459:  GetResponse(31)  .1.3.111.2.802.1.1.13.1.4.1=[endOfMibView]
09:49:41.249861 IP proxy.56459 > 1.2.3.4.snmp:  GetNextRequest(31)  .1.3.111.2.802.1.1.13.1.4.1
09:49:41.249999 IP 1.2.3.4.snmp > proxy.56459:  GetResponse(31)  .1.3.111.2.802.1.1.13.1.4.1=[endOfMibView]
09:49:41.250180 IP proxy.56459 > 1.2.3.4.snmp:  GetNextRequest(31)  .1.3.111.2.802.1.1.13.1.4.1
09:49:41.250966 IP 1.2.3.4.snmp > proxy.56459:  GetResponse(31)  .1.3.111.2.802.1.1.13.1.4.1=[endOfMibView]
09:49:41.251385 IP 1.2.3.4.snmp > proxy.56459:  GetResponse(31)  .1.3.111.2.802.1.1.13.1.4.1=[endOfMibView]
09:49:41.251438 IP proxy.56459 > 1.2.3.4.snmp:  GetNextRequest(31)  .1.3.111.2.802.1.1.13.1.4.1
09:49:41.251619 IP proxy.56459 > 1.2.3.4.snmp:  GetNextRequest(31)  .1.3.111.2.802.1.1.13.1.4.1
```
and you are probably right - snmp proxy doesn't correctly recognize "endOfMibView".
should I rise this case to net-snmp team ?

**Comment by PipoCanaja** [comment]
Probably yes. There is very little we can do on our side. But you should have this issue with other modules as well.

**Comment by maxilee** [comment]
I haven't found other OIDs which can cause high cpu usage on proxy - so this is strange that problem occur only on LLDPv2 oid as we use snmp proxy on more then 100 host and monitor >1000 endpoints , different endpoints : routers , switches ( eth and FC ), servers ( linux, windows, vmware ).
I'll create case in net-snmp team and let here know about results.

**Comment by murrant** [comment]
Closing this as an upstream issue.  FYI, you should also contact any vendors that have the non-increasing OIDs as that is a spec violation.
