### ISSUE TITLE
addhost with "force" flag is still attempting SNMP queries

### ISSUE THREAD

**Issue by candlerb** [librenms/librenms#4453]
DO NOT DELETE THIS INFORMATION.

> Please read this information carefully.

- [X] Is your install up to date? [Updating your install](http://docs.librenms.org/General/Updating/)
      Please do not submit an issue if your install is not up to date within the last 24 hours or on a stable monthly release.
- [X] Please include all of the information between the `====================================` section of `./validate.php`.
- [ ] If you would like us to add a new device then please provide the information asked for [here](http://docs.librenms.org/Support/FAQ/#faq20)
- [X] Please provide as much detail as possible.

~~~
Version info:
[WARN]    Your install is out of date: 361732bfc203c8476c8baf4e6663963b53099cf6 (Thu, 15 Sep 2016 10:36:55 +0000)
[WARN]    Your local git branch is not master, this will prevent automatic updates.
DB Schema: 118
PHP: 7.0.8-0ubuntu0.16.04.2
MySQL: 5.7.15-0ubuntu0.16.04.1
RRDTool: 1.5.5
SNMP: NET-SNMP version: 5.7.3
~~~

librenms allows you to add devices which are not currently online using "addhost.php -f", or by checking the Force flag in the GUI under Add Device. This is useful for batch preloading an NMS before deployment.

The GUI says `Force add - No ICMP or SNMP checks performed` so I would expect the device to be added immediately; but in fact it takes about a minute, and tcpdump shows that SNMP checks *are* being attempted.

To replicate:

~~~
# php addhost.php -f 1.2.3.4 foobar
<long pause>
Added device 1.2.3.4 (15)
~~~

Running `tcpdump -i eth0 -nn host 1.2.3.4` in another window shows:

~~~
listening on eth0, link-type EN10MB (Ethernet), capture size 262144 bytes
07:59:08.062254 IP 10.10.1.1.46977 > 1.2.3.4.161:  C=foobar GetRequest(28)  .1.3.6.1.2.1.1.5.0
07:59:09.063393 IP 10.10.1.1.46977 > 1.2.3.4.161:  C=foobar GetRequest(28)  .1.3.6.1.2.1.1.5.0
07:59:10.063538 IP 10.10.1.1.46977 > 1.2.3.4.161:  C=foobar GetRequest(28)  .1.3.6.1.2.1.1.5.0
07:59:11.064139 IP 10.10.1.1.46977 > 1.2.3.4.161:  C=foobar GetRequest(28)  .1.3.6.1.2.1.1.5.0
07:59:12.065218 IP 10.10.1.1.46977 > 1.2.3.4.161:  C=foobar GetRequest(28)  .1.3.6.1.2.1.1.5.0
07:59:13.065515 IP 10.10.1.1.46977 > 1.2.3.4.161:  C=foobar GetRequest(28)  .1.3.6.1.2.1.1.5.0
07:59:14.109764 IP 10.10.1.1.60210 > 1.2.3.4.161:  C=foobar GetRequest(28)  .1.3.6.1.2.1.1.1.0
07:59:15.110039 IP 10.10.1.1.60210 > 1.2.3.4.161:  C=foobar GetRequest(28)  .1.3.6.1.2.1.1.1.0
07:59:16.110832 IP 10.10.1.1.60210 > 1.2.3.4.161:  C=foobar GetRequest(28)  .1.3.6.1.2.1.1.1.0
07:59:17.111942 IP 10.10.1.1.60210 > 1.2.3.4.161:  C=foobar GetRequest(28)  .1.3.6.1.2.1.1.1.0
07:59:18.112734 IP 10.10.1.1.60210 > 1.2.3.4.161:  C=foobar GetRequest(28)  .1.3.6.1.2.1.1.1.0
07:59:19.112988 IP 10.10.1.1.60210 > 1.2.3.4.161:  C=foobar GetRequest(28)  .1.3.6.1.2.1.1.1.0
07:59:20.161374 IP 10.10.1.1.53913 > 1.2.3.4.161:  C=foobar GetRequest(28)  .1.3.6.1.2.1.1.2.0
07:59:21.162506 IP 10.10.1.1.53913 > 1.2.3.4.161:  C=foobar GetRequest(28)  .1.3.6.1.2.1.1.2.0
07:59:22.162833 IP 10.10.1.1.53913 > 1.2.3.4.161:  C=foobar GetRequest(28)  .1.3.6.1.2.1.1.2.0
07:59:23.163989 IP 10.10.1.1.53913 > 1.2.3.4.161:  C=foobar GetRequest(28)  .1.3.6.1.2.1.1.2.0
07:59:24.164592 IP 10.10.1.1.53913 > 1.2.3.4.161:  C=foobar GetRequest(28)  .1.3.6.1.2.1.1.2.0
07:59:25.165533 IP 10.10.1.1.53913 > 1.2.3.4.161:  C=foobar GetRequest(28)  .1.3.6.1.2.1.1.2.0
07:59:26.212137 IP 10.10.1.1.33219 > 1.2.3.4.161:  C=foobar GetRequest(32)  .1.3.6.1.2.1.47.1.1.1.1.2.1
07:59:27.212496 IP 10.10.1.1.33219 > 1.2.3.4.161:  C=foobar GetRequest(32)  .1.3.6.1.2.1.47.1.1.1.1.2.1
07:59:28.213558 IP 10.10.1.1.33219 > 1.2.3.4.161:  C=foobar GetRequest(32)  .1.3.6.1.2.1.47.1.1.1.1.2.1
07:59:29.214227 IP 10.10.1.1.33219 > 1.2.3.4.161:  C=foobar GetRequest(32)  .1.3.6.1.2.1.47.1.1.1.1.2.1
07:59:30.214698 IP 10.10.1.1.33219 > 1.2.3.4.161:  C=foobar GetRequest(32)  .1.3.6.1.2.1.47.1.1.1.1.2.1
07:59:31.215857 IP 10.10.1.1.33219 > 1.2.3.4.161:  C=foobar GetRequest(32)  .1.3.6.1.2.1.47.1.1.1.1.2.1
07:59:32.274938 IP 10.10.1.1.38814 > 1.2.3.4.161:  C=foobar GetRequest(31)  .1.3.6.1.4.1.6050.1.1.2.0
07:59:33.275194 IP 10.10.1.1.38814 > 1.2.3.4.161:  C=foobar GetRequest(31)  .1.3.6.1.4.1.6050.1.1.2.0
07:59:34.275759 IP 10.10.1.1.38814 > 1.2.3.4.161:  C=foobar GetRequest(31)  .1.3.6.1.4.1.6050.1.1.2.0
07:59:35.276907 IP 10.10.1.1.38814 > 1.2.3.4.161:  C=foobar GetRequest(31)  .1.3.6.1.4.1.6050.1.1.2.0
07:59:36.277494 IP 10.10.1.1.38814 > 1.2.3.4.161:  C=foobar GetRequest(31)  .1.3.6.1.4.1.6050.1.1.2.0
07:59:37.277790 IP 10.10.1.1.38814 > 1.2.3.4.161:  C=foobar GetRequest(31)  .1.3.6.1.4.1.6050.1.1.2.0
07:59:38.329326 IP 10.10.1.1.41061 > 1.2.3.4.161:  C=foobar GetRequest(31)  .1.3.6.1.4.1.39165.1.6.0
07:59:39.330454 IP 10.10.1.1.41061 > 1.2.3.4.161:  C=foobar GetRequest(31)  .1.3.6.1.4.1.39165.1.6.0
07:59:40.331583 IP 10.10.1.1.41061 > 1.2.3.4.161:  C=foobar GetRequest(31)  .1.3.6.1.4.1.39165.1.6.0
07:59:41.332361 IP 10.10.1.1.41061 > 1.2.3.4.161:  C=foobar GetRequest(31)  .1.3.6.1.4.1.39165.1.6.0
07:59:42.332741 IP 10.10.1.1.41061 > 1.2.3.4.161:  C=foobar GetRequest(31)  .1.3.6.1.4.1.39165.1.6.0
07:59:43.333508 IP 10.10.1.1.41061 > 1.2.3.4.161:  C=foobar GetRequest(31)  .1.3.6.1.4.1.39165.1.6.0
07:59:44.390812 IP 10.10.1.1.47543 > 1.2.3.4.161:  C=foobar GetRequest(33)  .1.3.6.1.4.1.2.6.182.3.3.1.0
07:59:45.391523 IP 10.10.1.1.47543 > 1.2.3.4.161:  C=foobar GetRequest(33)  .1.3.6.1.4.1.2.6.182.3.3.1.0
07:59:46.391680 IP 10.10.1.1.47543 > 1.2.3.4.161:  C=foobar GetRequest(33)  .1.3.6.1.4.1.2.6.182.3.3.1.0
07:59:47.391952 IP 10.10.1.1.47543 > 1.2.3.4.161:  C=foobar GetRequest(33)  .1.3.6.1.4.1.2.6.182.3.3.1.0
07:59:48.393070 IP 10.10.1.1.47543 > 1.2.3.4.161:  C=foobar GetRequest(33)  .1.3.6.1.4.1.2.6.182.3.3.1.0
07:59:49.393339 IP 10.10.1.1.47543 > 1.2.3.4.161:  C=foobar GetRequest(33)  .1.3.6.1.4.1.2.6.182.3.3.1.0
07:59:50.422193 IP 10.10.1.1.51901 > 1.2.3.4.161:  C=foobar GetRequest(36)  .1.3.6.1.4.1.674.10895.3000.1.2.100.1.0
07:59:51.423321 IP 10.10.1.1.51901 > 1.2.3.4.161:  C=foobar GetRequest(36)  .1.3.6.1.4.1.674.10895.3000.1.2.100.1.0
07:59:52.424407 IP 10.10.1.1.51901 > 1.2.3.4.161:  C=foobar GetRequest(36)  .1.3.6.1.4.1.674.10895.3000.1.2.100.1.0
07:59:53.425332 IP 10.10.1.1.51901 > 1.2.3.4.161:  C=foobar GetRequest(36)  .1.3.6.1.4.1.674.10895.3000.1.2.100.1.0
07:59:54.426347 IP 10.10.1.1.51901 > 1.2.3.4.161:  C=foobar GetRequest(36)  .1.3.6.1.4.1.674.10895.3000.1.2.100.1.0
07:59:55.426786 IP 10.10.1.1.51901 > 1.2.3.4.161:  C=foobar GetRequest(36)  .1.3.6.1.4.1.674.10895.3000.1.2.100.1.0
07:59:56.468660 IP 10.10.1.1.60609 > 1.2.3.4.161:  C=foobar GetRequest(32)  .1.3.6.1.2.1.47.1.1.1.1.12.1
07:59:57.468831 IP 10.10.1.1.60609 > 1.2.3.4.161:  C=foobar GetRequest(32)  .1.3.6.1.2.1.47.1.1.1.1.12.1
07:59:58.469346 IP 10.10.1.1.60609 > 1.2.3.4.161:  C=foobar GetRequest(32)  .1.3.6.1.2.1.47.1.1.1.1.12.1
07:59:59.470063 IP 10.10.1.1.60609 > 1.2.3.4.161:  C=foobar GetRequest(32)  .1.3.6.1.2.1.47.1.1.1.1.12.1
08:00:00.470202 IP 10.10.1.1.60609 > 1.2.3.4.161:  C=foobar GetRequest(32)  .1.3.6.1.2.1.47.1.1.1.1.12.1
08:00:01.471277 IP 10.10.1.1.60609 > 1.2.3.4.161:  C=foobar GetRequest(32)  .1.3.6.1.2.1.47.1.1.1.1.12.1
08:00:02.498526 IP 10.10.1.1.36517 > 1.2.3.4.161:  C=foobar GetRequest(28)  .1.3.6.1.2.1.1.5.0
08:00:03.499633 IP 10.10.1.1.36517 > 1.2.3.4.161:  C=foobar GetRequest(28)  .1.3.6.1.2.1.1.5.0
08:00:04.500011 IP 10.10.1.1.36517 > 1.2.3.4.161:  C=foobar GetRequest(28)  .1.3.6.1.2.1.1.5.0
08:00:05.501073 IP 10.10.1.1.36517 > 1.2.3.4.161:  C=foobar GetRequest(28)  .1.3.6.1.2.1.1.5.0
08:00:06.502619 IP 10.10.1.1.36517 > 1.2.3.4.161:  C=foobar GetRequest(28)  .1.3.6.1.2.1.1.5.0
08:00:07.502817 IP 10.10.1.1.36517 > 1.2.3.4.161:  C=foobar GetRequest(28)  .1.3.6.1.2.1.1.5.0
~~~

**Comment by laf** [comment]
I don't know where the code may be different but using hostnames doesn't exhibit this behavior.

**Comment by candlerb** [comment]
I tried adding to `/etc/hosts`:

~~~
1.2.3.4         dummy.example.com
~~~

but it doesn't make a difference for me:

~~~
$ time ./addhost.php -f dummy.example.com foobar
Added device dummy.example.com (2)

real	1m0.993s
user	0m0.776s
sys	0m0.124s
$
~~~

(tcpdump again shows the queries to 1.2.3.4)

**Comment by laf** [comment]
Update your install and try again

**Comment by candlerb** [comment]
Cool, fixed :-)

~~~
$ time ./addhost.php -f 1.2.3.6

SQL[SELECT `name` FROM `port_association_mode` ORDER BY pom_id]
SQL[SELECT COUNT(*) FROM `devices` WHERE `hostname` = '1.2.3.6']
SQL[SELECT `name` FROM `port_association_mode` ORDER BY pom_id]
SQL[SELECT `ipv4_address_id` FROM `ipv4_addresses` WHERE `ipv4_address` = '1.2.3.6']
SQL[SELECT `pom_id` FROM `port_association_mode` WHERE name = 'ifIndex']
SQL[SELECT `pom_id` FROM `port_association_mode` WHERE name = 'ifIndex']
SQL[SELECT COUNT(*) FROM `devices` WHERE `hostname` = '1.2.3.6']
SQL[INSERT INTO `devices` (`hostname`,`sysName`,`community`,`port`,`transport`,`status`,`snmpver`,`poller_group`,`status_reason`,`port_association_mode`,`os`)  VALUES ('1.2.3.6','1.2.3.6','NetManage','161','udp','1','v2c','0','','1','generic')]
SQL[SELECT * FROM `devices` WHERE `device_id` = '3']
SQL[SELECT * FROM `vrf_lite_cisco` WHERE `device_id` = '3'] Added device 1.2.3.6 (3)

real	0m0.083s
user	0m0.056s
sys	0m0.016s
~~~

Note: I see that commit also forces `$debug` to true in addhost.php - not sure if that was intentional.

**Comment by laf** [comment]
No, now removed $debug. Thanks.
